Unnamed: 0,drama_name,org_net,director,screenwriter,start_dt,end_dt,aired_on,year,tot_eps,time_per_ep,synopsis,actor_list,kor_title
1290,I Have a Lover,SBS,['Choi Moon Seok'],['Bae Yoo Mi'],2015-08-22,2016-02-28,"Saturday, Sunday",2015,50,78.0,"A coincidental switch of cars leads to a switch of fates for twins who were separated 30 yers ago. Hae Kang, the elder sister is a successful lawyer married to Jin Eon the successor of a top pharmaceutical company. Their love marriage is shattered by the death of their daughter and her husband's affair with Seol Ri, which ultimately leads to their divorce. But before the divorce  is officially declared, Yong Ki switches cars with Hae Kang to avoid being followed by people who are after her life. Yong Ki is the younger sister who is a pregnant widow trying to uncover the secrets behind her husband's sudden death. After the fateful encounter, Hae Kang ends up in a horrible accident (in the switched car) which makes her lose her memories. Baek Seok saves her and allows her to live with his family till she recovers but mistakes her to be his first love Yong Ki.Hae Kang as Yong Ki is no longer a cold and reserved person, instead she's warm, cheerful and caring. As Seol Ri and Jin Eon are in talks for marriage, he accidentally runs into Yong Ki. He is shocked at first but gradually begins suspecting that she's his wife and falls for her newly discovered bright self. She's shaken by his arrival too.(Source: Another Stranger at MyDramaList)","['Ji Jin Hee', 'Kim Hyun Joo', 'Lee Kyu Han', 'Park Han Byul']",애인 있어요
1291,To Be Continued,MBC every1 Naver TV Cast,,,2015-08-18,2015-09-03,Thursday,2015,12,75.0,This web drama is a teen fantasy story that tells the story of a male idol group (ASTRO)  that suddenly slips back in time just one day ahead of their debut stage. ,"['Kim Sae Ron', 'Cha Eun Woo', 'Rocky', 'MJ', 'Moon Bin', 'Jin Jin']",투 비 컨티뉴드
1292,The Eccentric Daughter-in-Law,KBS2,"['Lee Duk Gun', 'Park Man Young']",['Yoo Nam Kyung'],2015-08-17,2015-09-22,"Monday, Tuesday",2015,12,375.0,"Oh In Yeong is a former idol group singer. She belonged to a popular 4 member girl group, but, now, she isn't very popular anymore. In order to boost her flagging popularity, In Yeong agrees to appear in a television reality show that pairs up fake mothers- and daughters-in-law. While filming for the TV show, she meets her scripted mother-in-law Yang Chun Ja, a matriarch of a long-standing traditional clan. They end up hating each other on the show, but as fate would have it, the two later end up becoming mother and daughter-in-law for real.","['Ryu Soo Young', 'Go Doo Shim', 'Kim Da Som']",별난 며느리
1293,All About My Mom,KBS2,['Lee Geon Joon'],['Yoon Kyung Ah'],2015-08-15,2016-02-14,"Saturday, Sunday",2015,54,89.0,"Jin Ae has a love and hate relationship with her mother San Ok. She dreams of becoming independent from her family and especially from her mother. Jin Ae falls in love with Hoon Jae and marries him. Meanwhile, what awaits for Jin Ae is her new mother-in-law. While experiencing difficult times with her mother-in-law, Jin Ae begins to understand her mother San Ok for the first time. ","['Go Doo Shim', 'Lee Sang Woo', 'Oh Min Suk', 'Choi  Tae Joon', 'Kim Mi Sook', 'Eugene']",부탁해요 엄마
1294,Ugly Miss Young Ae Season 14,tvN,['Han Sang Jae'],"['Baek Sun Woo', 'Myung Soo Hyun', 'Choi Bo Rim', 'Han Sul Hee']",2015-08-10,2015-10-20,"Monday, Tuesday",2015,22,164.0,"This drama revolves around Young Ae and the prejudiced portrayal of chubby women and the stress they get from their superiors, colleagues and work. ","['Lee Seung Joon', 'Park Sun Ho', 'Kim Hyun Sook']",막돼먹은 영애씨 시즌14
1295,Yong Pal,SBS,['Oh Jin Suk'],['Jang Hyuk Rin'],2015-08-05,2015-10-01,"Wednesday, Thursday",2015,18,217.0,"Kim Tae Hyeon is a talented surgeon. Desperate for money to pay his sister's medical bills, he adopts the code name Yong Pal and offers his medical skills to those in need of medical attention but who cannot do so publicly, dealing with gangsters and corrupt plutocrats. It is while making such a house call that Tae Hyeon rescues ""sleeping beauty"" Han Yeo Jin, a chaebol heiress, from a medically induced coma, leading to unintended consequences.","['Kim Tae Hee', 'Chae Jung An', 'Joo Won', 'Jo Hyun Jae']",용팔이
1296,Mrs. Cop,SBS,"['Ahn Gil Ho', 'Yoo In Shik']",['Hwang Joo Ha'],2015-08-03,2015-09-29,"Monday, Tuesday",2015,18,217.0,"Choi Yeong Jin is a female detective squad chief. She also raises her daughter Ha Eun. At work, she deals with brutal crimes with her senior detective Park Jong Ho and squad members Min Do Yeong, Han Jin Woo, Jo Jae Deok and Lee Se Won. ","['Kim Hee Ae', 'Lee Da Hee', 'Son Ho Jun', 'Kim Min Jong']",미세스 캅
1297,Webtoon Hero - Tundra Show,MBC every1,,,2015-07-27,2015-10-19,Monday,2015,12,125.0,The drama follows the story of a father and three brothers. ~~ Based on the webtoon of the same name by popular writer Kian84. ,"['Park Jeong Hwa', 'Park Eun Seok', 'Kim Jung Seok', 'Jung Il Hoon', 'Go Hyun', 'Lee Chul Woo']",웹툰히어로-툰드라쇼
1298,Last,jTBC,"['Jo Nam Gook', 'Kim Sang Ho']",['Han Ji Hoon'],2015-07-24,2015-09-12,"Friday, Saturday",2015,16,236.0,"Fund manager Jang Tae Ho is a cocky but skilled stock manipulator, who is used to getting things done his way. But when he fails at a scheme worth 35 billion won, his life is in danger as a notorious moneylender, Mr. Jung, hunts him down for losing his 7 billion won. Broke and in hiding, Tae Ho joins the hungry and homeless on the streets around Seoul Station, dreaming of returning to his normal life, until he unexpectedly discovers its 10 billion Korean Won underground economy. The pecking order among the homeless at Seoul Station is stacked like a pyramid. All the money collected from begging to selling personal identities and organs flows up the 7 levels of ringleaders to “Number One”, Kwak Heung Sam, who reigns at the top. Tae-ho decides to take down each level’s ringleader and conquer the hierarchy at Seoul Station with wit, fists, and guts. Will he be able to recover the 10 billion won and return to normal life again?(Source: JTBC)","['Yoon Kye Sang', 'Lee Bum Soo']",라스트
1299,Assembly,KBS2,['Hwang In Hyuk'],['Jung Hyun Min'],2015-07-15,2015-09-17,"Wednesday, Thursday",2015,20,186.0,"Jin Sang Pil is a welder at a shipyard, but when he and his fellow workers get laid off, he fights for their reinstatement as the spokesman for the labor union. To his surprise, this leads to him becoming a newly elected member of the National Assembly. But because of his idealism and naiveté, Sang Pil finds it difficult to navigate the corridors of politics. Enter whip-smart aide Choi In Gyeong, who shows him the ropes and together they work to accomplish real change within the government.","['Jang Hyun Sung', 'Song Yoon Ah', 'Jung Jae Young', 'Park Young Gyu']",어셈블리
1300,The Scholar Who Walks the Night,MBC,['Lee Sung Joon'],['Jang Hyun Joo'],2015-07-08,2015-09-10,"Wednesday, Thursday",2015,20,180.0,"In Joseon Dynasty, immaculately dressed in scholarly robes, the young nobleman Kim Sung Yeol lives as a vampire to keep his promise to his friends. When Sung Yeol still was a human, he found out about the vampire Gwi who sits above the King deciding the next royal line and has resurrected as a vampire trying to fight against Gwi. And now, he is living as a guardian vampire fighting against the evil vampire without losing his human nature.(Source: MBC)~~ Adapted from the manhwa ""The Scholar Who Walks the Night"" (밤을 걷는 선비) by writer Jo Joo Hee (조주희) and artist Han Seung Hee (한승희).","['Kim So Eun', 'Lee Yoo Bi', 'Lee Joon Gi', 'Lee Soo Hyuk', 'Shim Chang Min']",밤을 걷는 선비
1301,I Order You,SBS Plus,['Ahn Gil Ho'],['Oh Bo Hyun'],2015-07-06,2015-07-30,"Monday, Tuesday, Wednesday, Thursday",2015,16,75.0,"Yeo Gook Dae is a talented chef who is cheeky and charismatic but heartbroken in the past because of his divorce. His emotional pain is hidden behind his brash attitude and enthusiasm for cooking. His heart later on gets healed when he begins to fall in love again. 28-year-old Park Song Ah is idling at home after quitting her job. She goes to a homemade dosirak (lunchbox) shop at her brother's request and meets three attractive men there. The pretty and delicious food that they make touch her, and she gets her heart stolen by one of them. A cute funny story about a couple who bicker constantly but their relationship gradually blossoms into pure innocent love.","['Kim Ga Eun', 'U-Know']",당신을 주문합니다
1302,Late Night Restaurant,SBS,['Hwang In Roe'],,2015-07-04,2015-09-05,Saturday,2015,20,90.0,A late night restaurant opens at midnight and closes at 7am. The owner and chef of the restaurant makes whatever his customers ask for. ,['Kim Seung Woo'],심야식당
1303,Oh My Ghost,tvN,['Yoo Je Won'],['Yang Hee Seung'],2015-07-03,2015-08-22,"Friday, Saturday",2015,16,225.0,"Bong Sun, a timid young woman, is possessed by the ghost of a lustful virgin. She has zero self-confidence, and because of her extreme shyness, she doesn’t have any close friends. At the restaurant where she works as an assistant, she’s not particularly good at anything, and mostly just gets yelled at a lot. Her grandmother was a shaman so from a young age she’s been able to occasionally see ghosts, though it’s not until she meets the lascivious ghost that she gets possessed totally.Sun Woo is a conceited star chef who’s overflowing with confidence in his food and his skills. Bong Sun harbours a secret crush on him, though he doesn't take much notice of her for two reasons: because he’s always surrounded by women and because he’s hung up on an old flame. But then one day, Bong Sun starts acting differently, shedding her mousy personality, and ends up constantly on Sun Woo’s mind.","['Im Joo Hwan', 'Kim Seul Gi', 'Jo Jung Suk', 'Park Bo Young']",오 나의 귀신님
1304,Yoo Mi's Room,O'live,,['Choi Woo Joo'],2015-06-30,2015-09-15,Tuesday,2015,12,125.0,"The coming-of-age sitcom depicts the struggles and adventures by a single lady, Yoo Mi, who tries to find her own happiness and what she really loves. ","['Lee Yi Kyung', 'Son Dam Bi']",유미의 방
1305,The Time We Were Not in Love,SBS,['Jo Soo Won'],"['Jung Do Yoon', 'Lee Ha Na']",2015-06-27,2015-08-16,"Saturday, Sunday",2015,16,240.0,"Choi Won is ""the perfect guy"" - good-looking, tall and fit with an amicable personality. Although he is very popular with women, he can't have a proper relationship because of his friend, Oh Ha Na. A romantic comedy about a man and a woman who have been best friends for 20 years (7000 days). They turn 34 and make a pact to be married before 35, and race each other to the altar while “helping” weed out potential suitors. They find that they're constantly dissatisfied with each other’s boyfriends and girlfriends, because they've really been in love all this time.","['Ha Ji Won', 'Lee Jin Wook', 'Yoon Kyun Sang', 'Choo Soo Hyun']",너를 사랑한 시간
1306,My Mother Is a Daughter-In-Law,SBS,['Ko Heung Sik'],['Lee Geun Young'],2015-06-22,2015-12-31,"Monday, Wednesday, Thursday, Friday, Tuesday",2015,136,18.0,"Gyeong Sook married a wealthy older man when she was 19 years old. Her mother-in-law, who gave her a hard time, died, and her husband passed away a couple of years ago. She only depends on her son Jeong Soo who is a doctor. Her son Jeong Soo brings his girlfriend, Hyeon Joo. Kyeong Sook disapproves of Hyeon Joo because of her poor family background.Nevertheless, Jeong Soo and Hyeon Joo marry. Kyeong Sook gives Hyeon Joo a hard time. Then, Jeong Soo dies in a car accident. Kyeong Sook and Hyeon Joo are no longer family. Kyeong Sook and Hyeon Joo eventually both marry again. Through a twist of fate, Kyeong Sook becomes Hyeon Joo's daughter-in-law.(Source: AsianWiki)","['Shim Yi Young', 'Kim Hye Ri']",어머님은 내 며느리
1307,Hello Monster,KBS2,"['Kim Jin Won', 'No Sang Hoon']",['Kwon Ki Young'],2015-06-22,2015-08-11,"Monday, Tuesday",2015,16,262.0,"Genius profiler Lee Hyun, returns home to Korea after something from a case he’s been sent triggers a memory he thought he’d lost forever. Unbeknownst to him, one of his team members, Detective Cha Ji An, has been investigating him for some time. She is aware that his father was murdered and his brother disappeared under mysterious circumstances involving a criminal named Lee Joon Young -- whom they both want found and incarcerated. Each seeks to unravel the other, unaware that they’ve been drawn into a dangerous game of cat and mouse by a master player and that both truth and evil are closer and far more twisted than they think.(Source: Wikipedia)","['Jang Na Ra', 'Choi Won Young', 'Seo In Guk', 'Park Bo Gum']",너를 기억해
1308,My Beautiful Bride,OCN,"['Kim Chul Gyu', 'Kim Sang Woo']",['Yoo Sung Yeol'],2015-06-20,2015-08-09,"Saturday, Sunday",2015,16,225.0,"Kim Do Hyung, who works as a bank executive and comes from a well-to-do family, has been dating his girlfriend, Yoon Joo Young, for the past two years. He asks her to marry him, but Joo Young is tormented by his proposal and is terrified that Do Hyung will find out about her checkered past. After Joo Young makes up her mind to accept the marriage proposal, she suddenly disappears without a trace. When Do Hyung files a missing-person report with the police, officer Cha Yoon Mi is surprised to learn that Joo Young is someone she knows from her past but can’t offer much help to Do Hyung. When Do Hyung undertakes the search for Joo Young on his own, he is drawn into the shadowy underground world of gangsters and loan sharks. When Song Hak Soo, the leader of an underground crime syndicate who was recently released from prison, suddenly shows up dead, Do Hyung inexplicably becomes the prime suspect in the murders of Hak Soo and Joo Young, although she is still missing. With Yoon Mi and her partner, Park Hyung Shik, hot on his heels, can Do Hyung find Joo Young and clear his own name?(Source: Viki)","['Lee Si Young', 'Kim Mu Yeol', 'Go Sung Hee', 'Park Hae Joon', 'Ryu Seung Soo']",아름다운 나의 신부
1309,Hidden Identity,tvN,['Kim Jung Min'],['Kang Hyun Sung'],2015-06-16,2015-08-04,"Monday, Tuesday",2015,16,225.0,"The story of the investigative team Number 5 specially organized to actively combat crime through stake outs, wiretapping, communications monitoring, and deep-cover infiltration. A secret police unit that bends the limits of the law in order to fight crime, the new department comes in addition to the existing departments for criminal investigations, special investigations, criminal affairs, and white collar crime. ","['Park Sung Woong', 'Kim Bum', 'Lee Won Jong', 'Yoon So Yi']",신분을 숨겨라
1310,Great First Wives,MBC,"['Kim Heung Dong', 'Kim Sung Wook']",['Hwang Soon Young'],2015-06-15,2015-12-04,"Monday, Tuesday, Wednesday, Thursday, Friday",2015,121,20.0,"Three women who shared a terrible secret twenty years ago during school years are reunited after they find themselves living in the same apartment complex. They now lead different lives but share the same problem with their husbands who are cheaters. Now, these three housewives, all betrayed by their husbands, bond together to revenge. Through the characters' proactive approach in trying to resolve their marital problems, this show will give the female viewers a cathartic relief.(Source: MBC)","['Lee Jong Won', 'Kim Ji Young', 'Ahn Jae Mo', 'Kang Sung Yun', 'Hwang Woo Seul Hye', 'Hwang Dong Joo']",위대한 조강지처
1311,The Return of Hwang Geum Bok!,SBS,['Yoon Ryu Hae'],['Ma Joo Hee'],2015-06-08,2015-12-11,"Monday, Tuesday, Wednesday, Thursday, Friday",2015,125,19.0,"A mother lives her whole life loyally in the lowest of places for the daughter of hers who is embarassed about her mother. But one day, her mother disappears. The daughter has no mother to hug, to complain to or see. Then there's the authority who is hiding the truth about this accident... ","['Kim Jin Woo', 'Lee Elijah', 'Shin Da Eun', 'Jung Eun Woo']",돌아온 황금복
1312,High Society,SBS,['Choi Young Hoon'],['Ha Myung Hee'],2015-06-08,2015-07-28,"Monday, Tuesday",2015,16,225.0,"Jang Yoon Ha is the youngest daughter of a chaebol (family-owned conglomeration). Even though her family is extremely wealthy, she holds a part-time job at a food market. She hides her background as an heiress and attempts to find a man that loves her for herself. ","['Im Ji Yeon', 'Sung Joon', 'Park Hyung Sik', 'Uee']",상류사회
1313,Oh! Grandmas,KBS1,['Kwak Gi Won'],,2015-05-31,2015-07-22,Wednesday,2015,8,412.0,The drama depicts the episodes that people go through raising an abandoned baby together in a rural village in Paju. ,"['Yun Woon Kyung', 'Jeon Won Joo', 'Heo Jin', 'Nam Neung Mi', 'Baek Soo Ryun']",오! 할매
1314,My Love Eun Dong,jTBC,"['Lee Tae Gon', 'Kim Jae Hong']",['Baek Mi Kyung'],2015-05-29,2015-07-18,"Friday, Saturday",2015,16,244.0,"“We were together for too short and separated for too long.” Eun Ho is an A-list South Korean actor, and for 20 years, he is searching for his first love, Eun Dong. They were teenagers when they first met, and after a brief friendship, she disappeared. Ten years later, they miraculously run into each other and start dating, but one day, Eun Dong doesn't return to meet Eun Ho as planned. Another ten years pass, and when Eun Ho is a famous star, he decides to publish a book about his love story to find Eun Dong. Meanwhile, Eun Dong becomes a writer and is living with a new name ever since she lost her memories due to the tragic accident that kept her from returning to Eun Ho. Through a mutual friend, she is hired to ghostwrite Eun Ho's book! During the process, she begins to uncover secrets that unravel the life she knows.(Source: JTBC)","['Joo Jin Mo', 'Kim Sa Rang']",사랑하는 은동아
1315,The Man in the Mask,KBS2,['Kim Yong Soo'],['Choi Jin Won'],2015-05-20,2015-07-09,"Wednesday, Thursday",2015,16,262.0,"During the day, Ha Dae Cheol is a righteous prosecutor, but at night he wears a mask and seeks to punish those that the law could not. Yoo Min Hee is a female detective in charge of the violent crime division. ","['Kim Sun Ah', 'Joo Sang Wook']",복면검사
1316,A Daughter Just Like You,MBC,"['Oh Hyun Jong', 'Park Won Gook']",['Ga Sung Jin'],2015-05-18,2015-11-06,"Monday, Tuesday, Wednesday, Thursday, Friday",2015,120,18.0,"This family-oriented show revolves around three different families clashing through a lot of misunderstandings as they become in-laws with each other: a popular female host on a shopping channel and her three daughters who are a college professor, high-powered consultant, and doctor, a divorced spouse who loves to regale stories about his time in the Marines, he has dried skin from doing the dishes every day; and a daughter from a rich family that that runs a successful fashion designer company. Their problems clear up slowly through love and understanding that result in a healing process.(SourcE: MBC)","['Lee Soo Kyung', 'Jung Hye Sung', 'Woo Hee Jin', 'Kim Hye Ok', 'Kang Tae Sung', 'Kang Kyung Joon']",딱 너 같은 딸
1317,Love of Eve,MBC,['Lee Gye Joon'],,2015-05-18,2015-10-30,"Monday, Tuesday, Wednesday, Thursday, Friday",2015,120,20.0,"Three women share a close bond that was deeper than any friendship. Song Ah, Sen Na, and Hyun Ah were both the same age and went to the same schools. Song Ah was an especially giving friend who would do anything for a friend. She absolutely trusted Sen Na and treated her like a sister along with her twin sister Hyun Ah. She thought they would always maintain a close relationship. But she had no idea that Sen Na was planning revenge.(Source: MBC)","['Kim Min Kyung', 'Lee Dong Ha', 'Yoon Se Ah', 'Lee Jae Hwang', 'Yoon Jong Hwa']",이브의사랑
1318,The Producers,KBS2,"['Pyo Min Soo', 'Yoon Sung Ho', 'Seo Soo Min']",['Park Ji Eun'],2015-05-15,2015-06-20,"Friday, Saturday",2015,12,425.0,"The drama is set in the backstage world of broadcasting industry. The story revolves around the dynamic work and life of people who work in the entertainment division of television network. Ra Jun Mo, a 10-year veteran PD of variety shows, is described to have a long list of variety shows credit but without a notable program under his name. 10-year veteran music show PD, Tak Ye Jin, is described to have started out as an innocent and smart young rookie but the harsh working competition has changed her personality. She now becomes a sharp and prideful woman who says whatever is on her mind even in front of her bosses.Rookie variety show PD, Baek Sung Chan, leaves a bright path as a prosecutor for a career in broadcast industry because of love. Diva-like top celebrity singer, Cindy, began as a trainee at the age of 13 and has been in the industry for 10 years. She’s known as an ice princess because she never lets herself feel deep affection for anyone. She experienced a lot of betrayal in the past that causes her to keep everyone at a safe distance. The story will leave various deep messages about friendship, family, fame, support, bullying and betrayal in the broadcast industry.","['Cha Tae Hyun', 'Kim Soo Hyun', 'Gong Hyo Jin', 'IU']",프로듀사
1319,Orange Marmalade,KBS2,"['Lee Hyung Min', 'Choi Sung Bum']",,2015-05-15,2015-07-24,Friday,2015,12,250.0,"Set in a fantasy world where humans and vampires coexist, the latter have evolved and no longer rely on human blood as food. Still, they are feared and discriminated against by society, causing many of them to hide their true nature and live as ""normal"" citizens, or else become outcasts.Baek Ma Ri is a socially withdrawn teenage girl hiding her vampire identity. Driven away from several neighborhoods, she is eager to settle down in her new city and live quietly. But things change when she falls in love with Jung Jae Min, the most popular boy at her high school.","['Kim Seol Hyun', 'Yeo Jin Goo', 'Lee  Jong Hyun']",오렌지 마말레이드
1320,Warm and Cozy,MBC,"['Park Hong Kyun', 'Kim Hee Won']","['Hong Jung Eun', 'Hong Mi Ran']",2015-05-13,2015-07-02,"Wednesday, Thursday",2015,16,225.0,"A man and a woman hit by setbacks and spurned by lovers meet one another on Jeju Island. The woman needs time to nurse her wounds after her career and relationship implode. The man is still smarting from a bad relationship that has closed his heart.  When together, they become themselves again, warm and friendly. Neither too hot nor cold.This is about two people recovering from their life troubles to bring warmth back into their lives. Kun Woo is following in the footsteps of the Great Gatsby, who was hopelessly in love with Daisy and sacrificed everything. But then Kun Woo faces an obstacle in pursuing his love interest. It's time for him to make a stand. He will save Daisy from all of her troubles. As he finds himself inextricably linked with a blunt and coarse woman who has no idea what true love is, he finds that he has a soft spot for her. Warm and mild...(Source: MBC)","['Kang So Ra', 'Yoo Yeon Seok']",맨도롱 또똣
1321,Save the Family,KBS1,,['Hong Young Hee'],2015-05-11,2015-10-30,"Monday, Tuesday, Wednesday, Thursday, Friday",2015,123,17.0,"Woo-Jin is an ambitious doctor who no longer believes in true love, after having failed before. He views marriage as just a business. Hae-Soo works as an assistant chef. She dreams of getting married to the right man and having a family. Woo-Jin soon falls in love with her, he comes into conflict with love and ambition. ","['Kang  Byul', 'Jae Hee', 'Jung Hye In']",가족을 지켜라
1322,Ex-Girlfriend Club,tvN,['Kwon Seok Jang'],['Lee Jin Mae'],2015-05-08,2015-06-13,"Friday, Saturday",2015,12,300.0,"Bang Myeong Soo is a popular writer of webtoons. He then writes a webtoon series about his past relationships, specifically his four ex-girlfriends, which includes an older, wealthy divorcee, a chic and successful woman who works at an investment firm, and a third-rate, airhead actress. The webtoon reveals plenty of details about Myeong Soo's love life, and it becomes a huge hit. Soon, Myeong Soo is considered a cross between Public Enemy Number One and National Heartthrob, and his webtoon gets adapted into a movie.Kim Soo Jin is a film producer who's prepared to do whatever it takes to save their failing production company. Because of this, she accepts the assignment to produce a webtoon adaptation. But to her horror, Soo Jin belatedly finds out that the webtoon artist is her ex-boyfriend Myeong Soo, and that she's one of the girlfriends he wrote about. And as the movie starts shooting, the project also brings Myeong Soo's other ex-girlfriends back into his life all at the same time.","['Song Ji Hyo', 'Ryu Hwa Young', 'Lee Yoon Ji', 'Byun Yo Han', 'Jang Ji Eun']",구여친클럽
1323,Girl of 0AM,MBC every1,,,2015-05-04,2015-05-14,,2015,8,112.0,"Gong Ji Dan, dreams of becoming a superstar. He coincidentally becomes in charge of a karaoke business, allowing him to grow as a singer. Meanwhile, Min Se Ra is a part-time worker, who leads Ji Dan to become a singer and holds a mysterious secret. ","['Nam Tae Hyun', 'Kim Min Ji']",0시의 그녀
1324,A Bird That Doesn't Sing,tvN,['Kim Pyung Joong'],['Yeo Jeong Mi'],2015-05-04,2015-10-22,"Monday, Tuesday, Wednesday, Thursday",2015,100,30.0,A 10 billion won insurance murder case causes Oh Ha Naui to lose everything. She sets out to take revenge upon Chun Mi Ja who caused her misfortune. ,"['Kang Ji Sub', 'Oh Hyun Kyung', 'Kim Yoo Suk', 'Hong Ah Reum', 'Ahn Jae Min', 'Baek Seung Hee']",울지않는 새
