Unnamed: 0,drama_name,org_net,director,screenwriter,start_dt,end_dt,aired_on,year,tot_eps,time_per_ep,synopsis,actor_list,kor_title
1215,Mirror of the Witch,jTBC,['Jo Hyun Taek'],['Yang Hyuk Moon'],2016-05-13,2016-07-16,"Friday, Saturday",2016,20,195.0,"A historical fantasy drama about a young man finding his way and love for a forgotten princess. Heo Jun faces discrimination as an illegitimate son and gives up on his natural talents, intelligence, and passion for academia. Succumbing to the limits of his social status, he resorts to making as much money as he can by using his good looks and witty charm. Meanwhile, Queen Sim is unable to conceive and she seeks the help of a shaman whose black magic enables her to have twins - a boy and a girl.However, the daughter, Seo Ri, is put under a curse and abandoned deep in the mountains, where one day, she meets Heo Jun. The curse of the abandoned princess is that whoever falls in love with her will die. Seo Ri tries to find a cure for her curse and along the way, creates magical treatments that help cure sick people. Unfortunately, Heo Jun accidentally sets the book of magic on fire, and he stays in the mountains with Seori to try to help heal the sick in a mountain village. As Heo Jun’s passion for medicine grows, he decides to become a doctor. As he sees Seo Ri fight against her destiny, his affinity for her grows, and he too begins to believe that he can change his destiny.(Source: JTBC)","['Kim Sae Ron', 'Yoon Shi Yoon']",마녀보감
1216,Dear My Friends,tvN,['Hong Jong Chan'],['Noh Hee Kyung'],2016-05-13,2016-07-02,"Friday, Saturday",2016,16,262.0,"Park Wan is a translator who is constantly pulled by her mother, Jang Nan Hee, to hang out with her elder friends, Jo Hee Ja, Moon Jung Ah, Oh Choong Nam, and Lee Yeong Won. The plot revolves around the friends' twilight years as they are rediscovering themselves through relationships and family, the struggles they face due to their old age, and their life journey that they share with  Park Wan in the hope she would write a novel about them.(Source: MyDramaList)","['Go Doo Shim', 'Park Won Sook', 'Youn Yuh Jung', 'Go Hyun Jung', 'Na Moon Hee', 'Kim Hye Ja']",디어 마이 프렌즈
1217,The Ordinary Life of Ms. 'O'! Season 2,,,,2016-05-11,2016-06-09,,2016,8,22.0,"Sometimes in life and work, you have someone you feel grateful for; there is also the choice between dieting and eating well, meeting an office couple, thinking of ways to be healthy and happy, the thought of quitting, and finding a new hobby or traveling as one of the ways to keep going. ",['Lee Chae Eun'],오구실 시즌2
1218,What's Your Blood Type?,,,,"May  3, 2016","May  3, 2016",,2016,7,17.0,,"['Oh Ji Ho', 'Go Kyung Pyo', 'Kim Seul Gi', 'Jo Bok Rae']",혈액형
1219,Good People,MBC,['Kim Heung Dong'],['Choi Yeon Geol'],2016-05-02,2016-10-28,"Monday, Tuesday, Wednesday, Thursday, Friday",2016,122,17.0,"When Yoon Jung Won is betrayed by family and friends who she completely trusted, the realization that humans are cruel dawns upon her. This show revolves around an insurance planner who is framed for a crime that she did not commit and tries to find justice after serving out her sentence in prison. There is a message of hope in the story in that while pain is inflicted on her by people around her, she eventually finds comfort and assistance from new people she encounters later.(Source: MBC)","['Woo Hee Jin', 'Hyun Woo Sung']",좋은 사람
1220,Another Miss Oh,tvN,['Song Hyun Wook'],"['Park Hae Young', 'Wi So Young']",2016-05-02,2016-06-28,"Monday, Tuesday",2016,18,233.0,"Two women, both named Oh Hae Young, find themselves constantly mixed up in each other’s lives because of their shared name. From confusion over boys and grades in high school to ending up in the same occupation and company as adults, they can't stop running into each other.And then there’s the man in their lives, a man with the ability to see into the future, a man who must decide which of these women he wants in it. Will these two women continue to find their lives entangled with each other? Or will they finally find a way to separate themselves from each other and become their own people?(Source: Apple TV)","['Seo Hyun Jin', 'Jeon Hye Bin', 'Eric Mun']",또! 오해영
1221,The Flower in Prison,MBC,"['Choi Jung Gyu', 'Lee Byung Hoon']",['Choi Wan Kyu'],2016-04-30,2016-11-06,"Saturday, Sunday",2016,51,76.0,"A story about Ok Nyeo, a talented girl born and raised in prison who gains great skill and wisdom through her encounters with extraordinary people from all walks of life. She becomes a crusader for the oppressed peasant class and embarks on a journey to find the class she belongs to in the caste system. Through the life of Ok Nyeo, this TV miniseries introduces Joseon’s proud legacy of human rights laws, which Ok Nyeo fights to enact throughout the kingdom.(Source: MBC)","['Go Soo', 'Jung Joon Ho', 'Jin Se Yeon']",옥중화
1222,The Master of Revenge,KBS2,['Im Se Joon'],['Chae Seung Dae'],2016-04-27,2016-06-30,"Wednesday, Thursday",2016,20,189.0,"A man whose name and life were taken from him seeks revenge. To do so, he must attempt to become a master noodle cook, or a god of noodles.~~ Adapted from the manhwa “God of Noodles” by Park In Kwon. ","['Gong Seung Yeon', 'Lee Sang Yeob', 'Jung Yoo Mi', 'Chun Jung Myung', 'Jo Jae Hyun']",마스터 - 국수의 신
1223,Entertainer,SBS,"['Hong Sung Chang', 'Lee Kwang Young']",['Yoo Young Ah'],2016-04-20,2016-06-16,"Wednesday, Thursday",2016,18,200.0,"Seok Ho is a manager who finds success in raising a highly popular idol group. He hopes for more success as he plans to take his group and build his own label, but he eventually falls flat on his face. He deceives people to find his way back to the top and meets Ha Neul, who gave up dreams to become a singer after losing his parents. Having been wrongly convicted of a crime, he is in a state of despair when he meets Seok Ho. Meanwhile, Seok Ho seems untrustworthy to Ha Neul's sister, Geu Rin. To protect her younger brother, Geu Rin takes a break from her university to work several part-time jobs. But seeing her younger brother feel lifted from despair when he meets Seok Ho, Geu Rin is determined to become his manager as he embarks on an inspiring life project, the Entertainers.(Source: Viki)","['Kang Min Hyuk', 'Chae Jung An', 'Lee Hye Ri', 'Ji Sung']",딴따라
1224,Dramaworld,Viki,,,2016-04-17,2016-05-15,Sunday,2016,10,120.0,"Claire Duncan is a 20-year-old college student obsessed with Korean Drama. She's constantly glued to the screen watching her favorite actor, Joon Park, in 'Taste of Love.' Disappointed that her own life isn't nearly as exciting as those within the world of K-drama, Claire desperately wishes that she too could live in a world of 'Taste of Love.' Thanks to a touch of magic, Claire finds her world turned upside-down when she is sucked through her smartphone into the world of 'Taste of Love' and comes face to face with Joon Park himself.Claire also meets Seth Ko, a waiter who has also magically transported into the world of dramas years ago. With his help, Claire learns to navigate this new place. But her presence begins to throw 'Taste of Love' off-balance, causing other dramas to splice into the series. As things spiral further out of control, Claire realizes she can no longer just watch the drama unfold. She's now part of it, and it's her job to set things right before everything falls apart completely.(Source: Wikipedia; Viki)","['Bae Noo Ri', 'Sean Richard', 'Liv Hewson', 'Justin Chon']",드라마월드
1225,The Royal Gambler,SBS,['Nam Gun'],['Kwon Soon Gyu'],2016-03-28,2016-06-14,"Monday, Tuesday",2016,24,188.0,"Baek Dae Gil and King Yeong Jo enter a match. Baek Dae Gil bets his life and King Yeong Jo bets the entire Kingdom of Joseon on the outcome. Baek Dae Gil is the best gambler in the Joseon era. He holds deep resentment inside but is also cool on the exterior. King Yeong Jo is a man who never lowers his head without a convincing reason. Meanwhile, Dam Seo exists solely to take revenge upon the king.","['Choi Min Soo', 'Im Ji Yeon', 'Jang Geun Suk', 'Yoon Jin Seo', 'Jeon Kwang Ryul', 'Yeo Jin Goo']",대박
1226,Monster,MBC,['Joo Sung Woo'],"['Jang Young Chul', 'Jung Kyung Soon']",2016-03-28,2016-09-20,"Monday, Tuesday",2016,50,76.0,"People who commit cruelty against the weak in order to enrich themselves with more money and power while answering to no one are monsters. A man takes on the corrupt elite or “monsters” whose identities are hidden from the public after he loses his family in a conspiracy that was engineered by very powerful people. In a twist, he finds love amid the shady underworld and through this turn of events, this TV miniseries sends a message of noblesse oblige and the true meaning of life.(Source: MBC)","['Park Ki Woong', 'Kim Su Hyun', 'Kang Ji Hwan', 'Sung Yoo Ri']",몬스터
1227,"My Lawyer, Mr. Jo",KBS2,"['Lee Jung Sub', 'Lee Eun Jin']","['Yoo Young Sun', 'Lee Hyang Hee']",2016-03-28,2016-05-31,"Monday, Tuesday",2016,20,180.0,"Once a star prosecutor with a bright future, Jo Deul Ho loses everything after becoming a whistleblower against the intolerable corruption he witnesses. He instead rebuilds his life as a lawyer at a small neighborhood law practice, committed to justice and protecting the innocent. ","['Kang So Ra', 'Park Shin Yang']",동네변호사 조들호
1228,Vampire Detective,OCN,"['Kim Ga Ram', 'Lee Seung Hoon']",['Yoo Young Sun'],2016-03-27,2016-06-12,Sunday,2016,12,305.0,Private detective Yoon San suddenly becomes a vampire. He solves various cases for his clients while also trying to uncover the mystery surrounding himself while maintaining his secret identity as he solves cases using his unique abilities. ,"['Oh Jung Se', 'Lee Se Young', 'Lee Joon']",뱀파이어 탐정
1229,Ms. Temper & Nam Jung Gi,jTBC,['Lee Hyung Min'],['Joo Hyun'],2016-03-18,2016-05-07,"Friday, Saturday",2016,16,244.0,"Although renowned as the youngest team supervisor in her company, Da Jung has been divorced three times already and is always surrounded by suspicion and disdain because of her bad temper. She is a strong and insensitive woman who doesn’t care that other people talk about her or that they call her ""Hot-tempered.” In contrast to the fiery Da Jung, Jung Gi is the timidest guy ever. Kind and inoffensive like a “Father Teresa,” he doesn’t say things other people may not like to hear and is seen as a pushover. After a dynamic series of twists and turns, Da Jung becomes Jung Gi’s new boss, and his rather peaceful life is about to face a tempestuous storm. “Hot-tempered"" Da Jung’s tyranny turns Jung Gi’s life upside down, but with more unexpected twists and turns, one timid man’s office survival story is about to shake things up as he takes on the world!(Source: JTBC)","['Lee Yo Won', 'Yoon Sang Hyun']",욱씨남정기
1230,Memory,tvN,['Park Chan Hong'],['Kim Ji Woo'],2016-03-18,2016-05-07,"Friday, Saturday",2016,16,244.0,"Park Tae Suk is a lawyer who finds out that he has Alzheimer’s and puts his life on the line to fight one last case. The drama depicts his vigorous efforts trying to protect the precious value of the life and family love, while his memory starts fading away. ","['Lee Sung Min', 'Park Jin Hee', 'Kim Jee Soo']",기억
1231,"Good-bye, Mr. Black",MBC,"['Han Hee', 'Kim Sung Wook']",['Moon Hee Jung'],2016-03-16,2016-05-19,"Wednesday, Thursday",2016,20,195.0,"Inspired by “The Count of Monte Cristo,” this TV show follows a devious plot of revenge and love. After searching for answers after a sudden tragedy, a man uncovers the betrayal of his best friend and devises a plot to exact revenge. To disguise his identity, he enters a phony marriage with a young woman but finds himself unexpectedly falling in love with her that restores his trust and confidence in humanity.(Source: MBC) ","['Song Jae Rim', 'Moon Chae Won', 'Yoo In Young', 'Lee Jin Wook', 'Kim Kang Woo']",굿바이 미스터 블랙
1232,Virtual Excitement,,,,"Mar 11, 2016","Mar 11, 2016",,2016,6,60.0,"On his first day working in a company, Kim Min Kyu is suddenly asked by a person if he knows himself.(Source: MyDramaList) ",['Kim Min Gue'],두근두근 가상연애
1233,Pied Piper,tvN,['Kim Hong Seon'],['Ryu Yong Jae'],2016-03-07,2016-04-26,"Monday, Tuesday",2016,16,244.0,"Every day on the job is tense, dangerous and possibly lethal! But the dangerous situations are diffused without using force by the expert negotiator Joo Sung Chan, who leads the police department’s negotiation task force. The team handles the most dangerous, volatile and high-risk situations that jeopardize the lives of innocent people. Hostage crises, terrorist threats, and other major catastrophes await Sung Chan, Yeo Myung Ha and the other highly skilled team of negotiators when they come into work every day. Son Hee Sung is a thorn in their side as an aggressive broadcast journalist who tries to report on the many coverage-worthy events.","['Yoo  Joon Sang', 'Shin Ha Kyun', 'Jo Yoon Hee']",피리부는 사나이
1234,My Little Baby,MBC,['Han Cheol Soo'],['Lee Eun Young'],2016-03-05,2016-04-23,Saturday,2016,16,169.0,"Cha Jung Han is a detective for a special investigation team. He is busy with investigating violent cases including drugs and gangs, but one day he takes in his niece Eun Ae and struggles to raise her.Han Ye Seul is a single mother who raises her 5-year-old son alone. She is Cha Jung Han’s first love. ","['Oh Ji Ho', 'Lee Soo Kyung']",마이 리틀 베이비
1235,Mrs. Cop Season 2,SBS,"['Kim Jung Hyun', 'Yoo In Shik']",['Hwang Joo Ha'],2016-03-05,2016-05-08,"Saturday, Sunday",2016,20,192.0,"After Choi Yeong Jin takes time off from work, Ko Yoon Jung becomes the new detective squad chief. She returned to South Korea after training with the F.B.I. in the United States. ","['Kim Bum', 'Kim Sung Ryung', 'Kim Min Jong']",미세스 캅 2
1236,Marriage Contract,MBC,['Kim Jin Min'],['Jung Yoo Kyung'],2016-03-05,2016-04-24,"Saturday, Sunday",2016,16,281.0,"After being diagnosed with a possibly terminal brain tumor, Kang Hye Soo, a desperate single mother, agrees to be a liver donor for her new boss’ mother. In exchange, she will receive a significant sum of money that she hopes to leave to her daughter. In order to pass the screening process, they must legally wed and convince the hospital that they’ve been in a long-term relationship. What they foolishly thought would be a quiet transaction between the two of them, quickly becomes more complicated as more people get involved, including her 7-year-old daughter. Money isn’t the only thing required for happiness, and love makes life worth living.","['Lee Seo Jin', 'Uee', 'Shin Rin Ah']",결혼계약
1237,Legend Hero,,,,2016-03-02,2016-08-18,,2016,50,28.0,"Bewildered fighter Liu Bei slowly recovers his dream he had as a child. Each Legend Hero has their own dream to achieve. The Dream Battlers such as Sun Ce, who wants to be the best martial artist in the universe, and Cao Cao, who wants to make this world righteous also participate in the spectacular Dream Battle.(Source: WelCon) ",['Lee Gi Chang'],레전드히어로 삼국전
1238,TV Novel: My Mind’s Flower Rain,KBS2,['Uh Soo Sun'],"['Han Hee Jung', 'Moon Young Hoon']",2016-02-29,2016-09-06,"Monday, Tuesday, Wednesday, Thursday, Friday",2016,128,16.0,"A story of a bright young girl who lost her family during the Korean War and grew up experiencing the rapid change of the Korean society in the 1970s. The story of dream, love, loss, forgiveness, and reconciliation between two generations of characters who lived through the tumultuous period of 1st and 2nd Korean War, from the 1950s to 1970s. ","['Lee Chang Wook', 'Jung Yi Yeon', 'Na Hae Ryung', 'Ji Eun Sung']",TV소설 내 마음의 꽃비
1239,Happy Home,MBC,['Lee Dong Yoon'],['Jo Eun Jung'],2016-02-27,2016-08-21,"Saturday, Sunday",2016,51,82.0,"A new building complex is built in Chinatown and Bong Sam Bong opens his Chinese restaurant called “Gahwamansasung” there with a big splash. But Bong’s luck does not last long after he had worked so hard from the bottom to finally open his own restaurant. His married children all get divorced and now his own wife is demanding a divorce, too. This show follows the drama-filled lives of Mr. Bong’s family as they run “Gahwamansasung,” the largest Chinese restaurant in Chinatown. The family overcomes a string of crises and through understanding, they resolve their differences and lingering family issues. Despite their fighting, they still stay tight as a family unit and will sit down together for a bowl of Chinese noodles for family dinners with lots of love and laughter.(Source: MBC)","['Kim So Yeon', 'Lee Sang Woo', 'Lee Pil Mo']",가화만사성
1240,"Please Come Back, Mister",SBS,['Shin Yoon Sub'],['Noh Hye Young'],2016-02-24,2016-04-14,"Wednesday, Thursday",2016,16,225.0,"Kim Young Soo is a department store worker who dies in an accident. Upon reaching the afterlife, he pleads for a chance to go back and clear up the misunderstandings surrounding his death and to comfort his newly widowed wife, Shin Da Hye. There with him is Han Gi Tak, a tough chef who also has loose ends to tie up concerning his death and those he left behind. The two are granted the chance to go back temporarily, but as new, different people, and with the condition that they cannot reveal their true identities. The return is made further complicated by the fact that Young Soo's body is identical to that of the new chief of the department store he used to work at, and Gi Tak comes back in the body of a woman. With only a short time to do everything they need to, the two have to work against all odds to make sure those they love will be ok without them.~~ Adapted from the novel ""Tsubakiyama Kacho no Nanokakan"" by Jiro Asada.","['Kim In Kwon', 'Rain', 'Lee Min Jung', 'Oh Yeon Seo', 'Kim Soo Ro', 'Lee Ha Nee']",돌아와요 아저씨
1241,Descendants of the Sun,KBS2,"['Baek Sang Hoon', 'Lee Eung Bok']","['Kim Eun Sook', 'Kim Won Seok']",2016-02-24,2016-04-14,"Wednesday, Thursday",2016,16,225.0,"A love story that develops between a surgeon and a special forces officer.Kang Mo Yeon is a pretty and assertive woman who works as a cardiothoracic surgeon at Haesung Hospital. She isn't afraid to admit her mistakes and believes that capability overrides whatever connections you have. However, she is soon faced with the reality that she cannot advance with just capability. Her life is forever changed when she encounters Yoo Shi Jin, the Captain and team leader of the Alpha Team who cares more about protecting anybody in need of help as well as his country, even if it goes against the order of his superiors. This drama will tell of how they both bond together in a time of war and overcome the odds against them.(Source: AJ at MyDramaList)","['Song Hye Kyo', 'Jin Goo', 'Song Joong Ki', 'Kim Ji Won']",태양의 후예
1242,Five Enough,KBS2,['Kim Jung Gyu'],['Jung Hyun Jung'],2016-02-20,2016-08-21,"Saturday, Sunday",2016,54,78.0,"After losing his wife five years ago, Lee Sang Ta is left with his two children. Since that time, he has lived with his two kids and parents-in-law, who treat him like their own son. He works as a marketing team leader for a fashion brand and never expects to find someone who will make his heart beat again. Ahn Mi Jeong works as an assistant manager at the same fashion company. 3 years ago, her husband had an affair with her friend and left her. She couldn't tell her 3 children the truth about their father and lied that he went to work in America. To this day, the children still believe that their father is in America. She has numbed herself from the struggles of raising her children alone while working. As these two begin to find love again, a tempest is brewing as three sets of in-laws and five children learn to become one family.(Source: AsianWiki)","['Shin Hye Sun', 'Ahn Jae Wook', 'Sung Hoon', 'Shim Yi Young', 'Shim Hyung Tak', 'So Yoo Jin']",아이가 다섯
1243,Thumping Spike,MBN,,['Choi Ji Yeon'],2016-02-20,2016-04-24,"Saturday, Sunday",2016,20,45.0,A volleyball coach and her players aim for success during which they develop stronger bonds of friendship and teamwork. This youthful story shows sportsmanship and heart thumping romance. ,"['Song Jae Rim', 'Hwang Seung Eon']",두근두근 스파이크
1244,"Yeah, That's How It Is",SBS,['Son Jung Hyun'],['Kim Soo Hyun'],2016-02-13,2016-08-14,"Saturday, Sunday",2016,54,83.0,A big family where three generations live together in one house faces challenges and conflicts together to finally realize the true meaning of family. ,"['Wang Ji Hye', 'Lee Soon Jae', 'Yoon So Yi', 'Kim Young Hoon', 'Kang Boo Ja', 'Hong Yo Sub']","그래, 그런거야"
1245,The Promise,KBS2,['Jeon Woo Sung'],"['Heo In Moo', 'Kim Yeon Shin']",2016-02-01,2016-06-24,"Monday, Tuesday, Wednesday, Thursday, Friday",2016,102,21.0,"Lee Na Yeon is made an orphan when chaebol heiress, Park Yu Gyeong, causes the death of her mother, Lee Yu Nae, in a traffic accident. Yu Nae and Yu Gyeong had been rivals in love for the same man, Jang Gyeong Wan, with Yu Gyeong ensnaring him into marriage by claiming the child she is carrying is his. Jang attempts to make amends for abandoning his college sweetheart by trying to give the orphaned Nayeon a home, to the anger of Yu Gyeong and the jealousy of his daughter, Se Jin. When Na Yeon discovers evidence that her mother's death may be more than an accident, she forgoes the chance of a life of wealth and privilege for an orphanage. Taken in by the widow of the man who ran down her mother, Na Yeon grows up alongside Tae Jun, an impoverished but driven and academically brilliant young man who becomes the love of her life. However, he cheats on her for his own success and goes with Se Jin.(Source: Wikipedia)","['Park Ha Na', 'Lee Yoo Ri', 'Song Jong Ho', 'Seo Joon Young']",Pangako Sa 'Yo
1246,Local Hero,OCN,['Kwak Jung Hwan'],['Jang Min Seok'],2016-01-23,2016-03-20,"Saturday, Sunday",2016,16,244.0,"Baek Shi-Yoon is an ex-secret agent and a well-trained human weapon. Hiding his past, he buys the bar ""Neighborhood"" and runs it is as the owner. He gets close to the neighborhood regulars at his bar and sympathizes with their pain. Shi-Yoon then meets a young man who works as a temporary employee, but who wants to become a police officer. Shi-Yoon trains him as a secret agent and they fight together against evil. ","['Jo Sung Ha', 'Kwon Yu Ri', 'Lee Soo Hyuk', 'Park Shi Hoo']",동네의 영웅
1247,At First Sight,,,,2016-01-22,2016-01-27,,2016,6,70.0,After a disappointment in love Sora receives an invitation from an app called that takes her back in time. ,,첫눈에
1248,Madame Antoine,jTBC,['Kim Yoon Cheol'],['Hong Jin Ah'],2016-01-22,2016-03-12,"Friday, Saturday",2016,16,244.0,"Soo Hyun is a psychologist based in America who has famous celebrities as his patients. But he suddenly returns to Korea and opens a psychotherapy center. A fraud fortune-teller named Hye Rim steals all of Soo Hyun's clients with her uncanny ability to read people’s minds seconds after meeting them. With his pride wounded, Soo Hyun decides to come up with a psychological experiment to perform on Hye Rim for his own research and revenge for the loss of his clients. As part of this experiment, three attractive men, including Soo Hyun, use all their charms to seduce Hye Rim and make her fall in love with them. Soo Hyun believes that he cuts a dashing figure and is quite accomplished professionally compared to the other two men; Seung Chan, Soo Hyun’s brother, wins over women’s hearts by treating them like queens; Ji Ho is an attractive and eccentric young genius. Hye Rim hadn’t believed in love until she becomes the lover of three different men. As she is caught up in the whirlwind of a romance that follows, her cynicism towards love crumbles. Will Hye Rim remain in love with Soo Hyun even after she realizes that she was just a participant in his psychological love experiment?(Source: JTBC)","['Sung Joon', 'Jung Jin Woon', 'Han Ye Seul', 'Lee Joo Hyung']",마담 앙트완
1249,Signal,tvN,['Kim Won Suk'],['Kim Eun Hee'],2016-01-22,2016-03-12,"Friday, Saturday",2016,16,281.0,"Fifteen years ago, a young girl was kidnapped on the way from school, and Park Hae Yeong, who was an elementary school student at that time, witnessed the crime. A few days later, the girl was found dead, and the police were not able to find the culprit. As time went by, Hae Yeong started distrusting the police. Fifteen years later, Hae Yeong is now a police officer and criminal profiler. One day, he finds a walkie-talkie that allows him to get in contact with Detective Lee Jae Han who is in the past. Police officers Hae Yeong, Jae Han, and Cha So Hyun then set out on a journey to solve cold cases.(Source: MyDramaList)","['Lee Je Hoon', 'Kim Hye Soo', 'Jo Jin Woong']",시그널
1250,One More Happy Ending,MBC,['Kwon Sung Chang'],['Heo Sung Hee'],2016-01-20,2016-03-10,"Wednesday, Thursday",2016,16,262.0,"This drama focuses on the story of former singer Han Mi Mo who was in a band called “Angels,” and her friends in their 30’s. As the divorce rate and second marriages are becoming higher in the nation, these friends, too, are looking for love again after a string of failed marriages and relationships. A divorcee, a single dad, a 30-year-old Matrix single, and a husband in a hopeless marriage are intertwined in Han and her friend’s life, and this romantic comedy will depict how the characters go to great lengths to find romance and happiness in a fun and entertaining way.(Source: MBC)","['Jang Na Ra', 'Yoo In Na', 'Jung Kyung Ho', 'Kwon Yool', 'Yoo Da In', 'Seo In Young']",한번 더 해피엔딩
