Unnamed: 0,drama_name,org_net,director,screenwriter,start_dt,end_dt,aired_on,year,tot_eps,time_per_ep,synopsis,actor_list,kor_title
1121,Mask,SBS,['Boo Sung Chul'],['Choi Ho Chul'],2015-05-27,2015-07-30,"Wednesday, Thursday",2015,20,180.0,"Byun Ji Sook has always had a hard life with her father constantly going into debt and being chased by loan sharks. She desperately wants to know what life is like if she was born into a better family and didn’t have to worry about money all the time.When a series of circumstances brings Ji Sook to Eun Ha, a woman from a wealthy family who strongly resembles Ji Sook, she grabs hold of the chance for a better life and assumes Eun Ha’s identity and begins to live her elite life. She meets Min Woo, a chaebol heir who is mistrusting of the people around him. But when he realizes that Ji Sook is not like the other women he has met, he is drawn to her. How long can Ji Sook keep up the charade and hide her true identity?(Source: Amazon)","['Yoo In Young', 'Park Soo Ae', 'Joo Ji Hoon', 'Yeon Jung Hoon']",가면
1256,Welcome to My Lab,Tooniverse,,,2015-12-22,2016-02-09,Tuesday,2015,8,375.0,"We follow the journey of students in a science club at Saebyeok School. ~~ Adapted from the comic ""Welcome to My Lab"" (내일은 실험왕) written by Gumdori Co (곰돌이Co) and illustrated by Hong Jung Hyeon (홍종현). ","['Lee Soo Min', 'Yoo Jun', 'Jung Sung Young', 'Jung Taek Hyun']",내일은 실험왕
1257,Witch's Castle,SBS,['Jung Hyo'],['Park Ye Kyung'],2015-12-14,2016-06-10,"Monday, Tuesday, Wednesday, Thursday, Friday",2015,122,20.0,"Oh Dan-Byul lost her parents due to her own mistake. She marries Joon-Young, but her husband passes away. Meanwhile, her mother-in-law, Ho-Duk, divorces because of her husband's infidelity and her sister-in-law, Se-Sil, returns to South Korea after divorcing her Italian husband. Now, these three women live together while overcoming their own personal problems and becoming important to each other. ","['Choi Jung Won', 'Seo Ji Suk', 'Yoo Ji In']",마녀의 성
1258,Cheers to Me,O'live,,,2015-12-10,2016-01-07,Thursday,2015,10,150.0,"An ordinary single woman who enjoys cooking and dining alone in the evenings, Ra Yeo Joo is an editor at a publishing house where she’s worked for the past ten years, while Lee Jae Yoon works in marketing at the same company. Their relationship is sometimes friendly, sometimes flirty, and sometimes competitive. They have different approaches to food: while she finds healing in food and drink, his goal in life is to live lean and long, until he discovers new pleasures and changes because of her.","['Yoon Jin Seo', 'Lee Jae Yoon']",나에게 건배
1259,Remember: War of the Son,SBS,['Lee Chang Min'],['Yoon Hyun Ho'],2015-12-09,2016-02-18,"Wednesday, Thursday",2015,20,180.0,"Seo Jin Woo has hyperthymesia, a condition that makes him remember life experiences in vivid detail. His father, wrongfully accused of murder, was tied and put on death row. Determined to prove his father's innocence, Jin Woo uses his ability to save him.(Source: MyDramaList) ","['Park Sung Woong', 'Namkoong Min', 'Park Min Young', 'Jung Hye Sung', 'Yoo Seung Ho']",리멤버 – 아들의 전쟁
1260,The Dearest Lady,MBC,"['Choi Chang Wook', 'Choi Joon Bae']",['Seo Hyun Joo'],2015-12-07,2016-05-20,"Monday, Tuesday, Wednesday, Thursday, Friday",2015,116,18.0,An upbeat family-oriented TV miniseries with a mishmash of different generations and different attitudes towards relationships. The difficulties that arise between mother and daughter mostly due to the men they are having a relationship with becomes the central plot that illustrates the challenges that single moms and divorcees face in today’s society. Their lives and the lives of the people they are connected to are depicted in a way that viewers can relate to through a fuzzy warm feeling called love.(Source: MBC),"['Kang Tae Oh', 'Ha Hee Ra', 'Jo An', 'Kwak Hee Sung', 'Kang Min Kyung', 'Jung Chan']",최고의 연인
1261,Imaginary Cat,MBC every1,['Lee Hyun Joo'],['Kim Sun Young'],2015-11-24,2016-01-12,Tuesday,2015,8,262.0,"Hyun Jong Hyun is a webtoon writer and works part-time at a bookstore. He always dreamed of working as a webtoon writer, but he has difficulties due to his stubborn and self-centered personality. He also has a cat named Boggil. He first met his cat on the street on a rainy day. Since then, they have lived together, and Hyun Jong Hyun only opens his mind to Boggil.~~ Adapted from the webtoon ""Imaginary Cat"" (상상고양이).","['Yoo Seung Ho', 'Han Ye Ri', 'Cho Hye Jung']",상상고양이
1262,"Sweet, Savage Family",MBC,['Kang Dae Sun'],['Son Geun Joo'],2015-11-18,2016-01-14,"Wednesday, Thursday",2015,16,236.0,"At home, Tae Soo is a nurturing dad and devoted husband but, at work, he is a cold-blooded mobster who metes out punishment and engages in bloody turf battles. While he is a dutiful son to his mother and takes care of all of her needs, he is a middle-aged married man, who cannot depend on his own kids to do the same for him in his old age. He is also in an awkward situation in the gang where he takes orders from the former gang boss and kingmaker while his young gang lieutenants are angling for his job. Tae Soo is trying to do what is best for his family while he has to evade the authorities who keep tabs on his gang activities, waiting to pounce on him once they obtain hard evidence of his criminal activities. “What is so evil about being a mobster? It’s all about making a living!” That’s how Tae Soo sees it.(Source: MBC)","['Jung Woong In', 'Yoo  Sun', 'Jung Joon Ho', 'Kim Eung Soo', 'Moon Jung Hee']",달콤살벌 패밀리
1263,Oh My Venus,KBS2,"['Kim Hyoung Seok', 'Lee Na Jung']",['Kim Eun Ji'],2015-11-16,2016-01-05,"Monday, Tuesday",2015,16,225.0,"Kim Yeong Ho is a personal trainer for Hollywood stars. He reluctantly comes back to Korea to face his family after a scandal with an actress. Even though he comes from a wealthy family background, he suffered a devastating injury during his childhood days. Now, he overcomes his problems with living a healthy lifestyle. Kang Joo Eun is a 33-year-old lawyer who was once the beauty of her school, nicknamed ""Daegu's Venus"". Over the years she has become overweight and unhealthy. She gets dumped by her boyfriend of 15 years.Kang Joo Eun meets Kim Yeong Ho, who agrees to be her personal trainer to help her get healthier. As they work on her physical transformation, they both discover they have feelings for each other. As they grow closer, they heal each other's emotional wounds and fall in love.","['Yoo In Young', 'So Ji Sub', 'Shin Min Ah', 'Jung Gyu Woon']",오 마이 비너스
1264,High-end Crush,MBN Naver TV Cast Sohu TV,['Ji Young Soo'],['Shin Yoo Dam'],2015-11-14,2016-01-17,"Saturday, Sunday",2015,20,45.0,"Choi Se Hoon is the head of G.Choi, a chart-topping K-pop entertainment agency with a top-billing roster of star acts. Many think he is blessed with the Midas touch, and he too believes he can make a star out of just about anyone he chooses to. He is rich and successful – but also aloof, arrogant, and conceited.One day, he meets a very unusual individual, Lee Yi Ryung, an innocent and naïve young woman from a humble and conservative countryside family. In almost every way, she is his polar opposite: shy, not brash, and humble, not self-important. He decides to recruit her to become G.Choi’s latest star, but is shocked to discover that she expresses no interest in becoming a K-pop singer.Things get even more complicated when he starts to fall for her – and discovers that winning this young woman’s heart is much harder than manufacturing K-pop success!(Source: Viki)","['Jung Il Woo', 'Jin Se Yeon']",고품격 짝사랑
1265,Beautiful You,MBC,"['Park Sang Hoon', 'Go Dong Sun']",['Park Jung Ran'],2015-11-09,2016-05-06,"Monday, Tuesday, Wednesday, Thursday, Friday",2015,122,17.0,"When her parents disapprove of her boyfriend, Seo Gyung decides to elope with him to America and only when she becomes a mother herself does she understand her parents and how important family is. During her darkest hours, her family was there for her. When she is caught in a love triangle with two suitors, she finds her true self through love, courage and emotional healing.(Source: MBC) ","['Lee Shi Won', 'Kang Eun Tak', 'Lee So Yeon', 'Seo Do Young']",最美是你
1266,Riders: Catch Tomorrow,E-Channel,['Choi Do Hoon'],['Park Sang Hee'],2015-11-08,2016-01-24,Sunday,2015,12,300.0,"Cha Ki Joon is a well-educated young man who begins his career in an enviable entry-level job at a large corporation. But he is not happy with his life. On a whim, Ki Joon decides to quit his job and start up a new business with his two childhood friends, Yoon So Dam and Go Tae Ra. So Dam has been working lots of different part-time jobs while trying to make it as an illustrator. Tae Ra is a former cycling athlete who decides to go in with Ki Joon on his new business idea – because it’s a company that will make rickshaws, of all things. As the three friends deal with the real world, changing friendships and budding relationships, can their crazy business possibly succeed?","['Lee Chung Ah', 'Kim Dong Wook', 'Yoon Jong Hoon', 'Choi Yeo Jin', 'Choi Min']",라이더스: 내일을 잡아라
1267,Reply 1988,tvN,"['Shin Won Ho', 'Yoo Hak Chan']",['Lee Woo Jung'],2015-11-06,2016-01-16,"Friday, Saturday",2015,20,285.0,"Five childhood friends, who all live in the same Ssangmundong neighborhood of Seoul, lean on each other to survive their challenging teen years and set a path for their futures. Sung Deok Sun struggles for attention as the middle child in her poor family while also carrying the burden of her 999th ranking in school. Kim Jung Hwan only has a one-track mind for soccer, even after his family becomes rich overnight. Sung Sun Woo is the perfect student, student council president and a caring and dependable son in his family. Ryu Dong Ryong is a geek who knows more about girls and life than the rest of his friends, but his poor academic score prevents him from being able to go to college. Choi Taek is a genius baduk player who dropped out of school to go professional. As the group of friends gets into and out of mischief around the neighborhood, what experiences from these memorable times together will they carry with them into their future lives? (Source: Viki)","['Lee Dong Hwi', 'Lee Hye Ri', 'Go Kyung Pyo', 'Ryu Joon Yeol', 'Park Bo Gum']",응답하라 1988
1268,Victory For Tomorrow,MBC,['Jung Ji In'],['Hong Seung Hee'],2015-11-02,2016-04-29,"Monday, Tuesday, Wednesday, Thursday, Friday",2015,130,16.0,"The most fragrant of all perfumes in the world is said to be made from roses that grow in a deep, treacherous mountain in the Balkans and plucked during the coldest nights. Beautiful pearls are painfully taken from clams by cracking them open. Han Seung Ri finds her life spiraling out of control after her dad's death that ruins the family finances. The man she loved betrays her and she has a miscarriage not too long afterward. After hitting rock bottom, she climbs out of her misery to take over the family business that her dad ran and marches forward to reach her dreams. Hopeful that tomorrow will be better than yesterday, she endures the pain and anguish to reach an outcome that is sweeter due to the ordeal she had to overcome to attain it.(Source: MBC)","['Jeon So Min', 'Choi Phillip', 'Song Won Geun', 'Yoo Ho Rin']",내일도 승리
1269,"Sweet Home, Sweet Honey",KBS1,['Kim Myung Wook'],['Kang Sung Jin'],2015-11-02,2016-04-29,"Monday, Tuesday, Wednesday, Thursday, Friday",2015,129,16.0,"Even though Oh Bom is in a difficult financial situation, she is still bright and positive. She works part-time work at a factory. Kang Ma Roo is a kind and simple young man. He is naive about the world. An Tae Ho is the section chief of a company. He is an ambitious man. He approaches Choi Ah Ran for his own gain and marries her. Choi Ah Ran is the heiress of a large company. She is smart, but has a painful past. Her younger sister went missing and her parents abandoned her.","['Song Ji Eun', 'Kim Min Soo', 'Lee  Jae Joon', 'Seo Yi Ahn']",우리집 꿀단지
1270,Heroes,QTV,,,2015-11-02,2016-02-22,Monday,2015,16,244.0,"A falling meteor gives a group of 20-something friends a newfound mission in life.Choi Hee Yeol, Park Hae Mil, and their friends love to spend their time playing video games. After a falling meteor gives them strange new powers, the friends establish a gaming company called Meteor Soft to create new video games using their powers.But when the major gaming company Next Media becomes threatened by Meteor Soft’s success, can Hee Yeol and his friends survive the tough corporate challenges they are about to face?(Source: Viki)","['Lee Elijah', 'Choi Jong Hoon', 'Park Doo Shik']",说英雄谁是英雄
1271,Bubblegum,tvN,['Kim Byung Soo'],['Lee Mi Na'],2015-10-26,2015-12-15,"Monday, Tuesday",2015,16,225.0,"Park Ri Hwan and Kim Haeng Ah are childhood friends who couldn’t be more different. As the director of an eastern medicine hospital, Ri Hwan selflessly cares for his patients and his mother, while Haeng Ah charges through her life as a feisty and headstrong radio producer. Yet despite their differences and after all these years, Ri Hwan and Haeng Ah complement each other perfectly. ","['Lee Jong Hyuk', 'Lee Dong Wook', 'Jung Ryeo Won', 'Park Hee Bon']",풍선껌
1272,Awl,jTBC,['Kim Seok Yoon'],"['Kim Soo Jin', 'Lee Nam Gyu']",2015-10-24,2015-11-29,"Saturday, Sunday",2015,12,325.0,"Soo In has a timid personality and is easily frightened, but he stands up for justice and does not cower in fear when he feels that he has been wronged. Early on in his military career, he becomes disillusioned with the falling standards and poor morale in an institution that supposedly practices strict discipline. This leads him to leave the military. In his new civilian life, he gets hired by a foreign retail distribution company and becomes the head manager of a large retail store. The retailer he works for slashes labor costs by firing part-time workers before they can qualify for benefits and higher wages. He cannot tolerate the company's poor and immoral treatment, so he decides to fight against the management. However, as he faces pressure from the company, he is forced to seek help from a labor counseling center and meets Go Shin, the center's manager. His only way to win the case is to utilize the Labor Act like a sword in his mission to fight against corruption and illegal corporate behavior. He boldly 'pierces into' the society that suppresses individual people with tyranny, just like an awl that bores a hole into the stiff wall... Soo In's lone fight to reclaim the labor rights workers have forgotten is about to begin!(Source:JTBC)","['Ahn Nae Sang', 'Ji Hyun Woo']",송곳
1273,The Village: Achiara's Secret,SBS,['Lee Yong Seok'],['Do Hyun Jung'],2015-10-07,2015-12-03,"Wednesday, Thursday",2015,16,244.0,"Achiara is a small, quiet, peaceful village with hardly any crime. But on her first day of school there, English teacher Han So Yoon discovers a buried corpse. As the townspeople speculate on the identity of the dead person and the reason she was killed, So Yoon and Police Officer Woo Jae attempt to find the truth. As they get closer, the ugliness of the village is revealed. ","['Jang Hee Jin', 'Yook Sung Jae', 'Shin Eun Kyung', 'Moon Geun Young', 'Ohn Joo Wan']",마을 - 아치아라의 비밀
1274,Because It's the First Time,On Style,['Lee Jeong Hyo'],['Jung Hyun Jung'],2015-10-07,2015-11-25,,2015,8,412.0,"With a freewheeling personality, Yoon Tae Oh is a 20-year-old freshman in college. He has been friends with Han Song Yi since they were little.  Now, he begins to have feelings for the girl who has a bright and positive personality. Meanwhile, Tae O has a friend, Seo Ji An, who is well-behaved and exemplary. A love triangle brews between these three people. ","['Jung Eugene', 'Kim Min Jae', 'Choi Min Ho', 'Lee Yi Kyung', 'Park So Dam', 'Cho Hye Jung']",처음이라서
1275,Sassy Go Go,KBS2,"['Lee Eun Jin', 'Kim Jung Hyun']","['Jung Chan Mi', 'Yoon Soo Jung']",2015-10-05,2015-11-10,"Monday, Tuesday",2015,12,300.0,"Set in a highly competitive school that emphasizes achievement and scores above all else, the drama will lay bare the absurdities and hypocrisies of the education system while also featuring the growth stories of the students who struggle to move forward, one step at a time. ","['Cha Hak Yeon', 'Chae Soo Bin', 'Jung Eun Ji', 'Lee Won Keun', 'Kim Ji Soo']",발칙하게 고고
1276,Glamorous Temptation,MBC,"['Kim Sang Hyub', 'Kim Hee Won']","['Son Young Mok', 'Cha Yi Young']",2015-10-05,2016-03-22,"Monday, Tuesday",2015,50,76.0,"A young woman learns from her whistleblower Dad that honesty is not the best policy. Soon after her marriage, she is saddled with crushing debt that she has no ability to repay. But through a series of events, she finds herself on track in joining the top wealthiest 1% and makes a deliberate effort to uncover their misdeeds and hypocrisy. Her efforts reveal limitless greed and lust for power fueled by the pursuit of money and profits. Two friends struggle to reach the same goal, which inadvertently forces them to cross paths as rivals that result in anguish, tense relations, betrayal and a love triangle. And through this turmoil, there is a happy ending of forgiveness and rediscovery of family. (Source: MBC)","['Jung Jin Young', 'Cha Ye Ryun', 'Joo Sang Wook', 'Choi Kang Hee']",화려한 유혹
1277,Alchemist,MBC every1,,,2015-10-05,2015-10-22,,2015,12,75.0,"The drama will center on the dating life of a refreshing female college student in her 20's, who falls in love at first sight for an upperclassman, leading her to join a forbidden society. ","['Han Ki Woong', 'Heo Young Ji']",연금술사
1278,Six Flying Dragons,SBS,['Shin Kyung Soo'],"['Kim Young Hyun', 'Park Sang Yeon']",2015-10-05,2016-03-22,"Monday, Tuesday",2015,50,72.0,"A fictional, historical drama about the ambition, rise and fall of real and fictional characters based around Yi Bang Won. Yi Bang Won was the third king of the Joseon Dynasty in Korea and the father of King Se Jong the Great. He helped his father, King Tae Jo, establish the Joseon Dynasty. ","['Chun Ho Jin', 'Yoon Kyun Sang', 'Yoo Ah In', 'Kim Myung Min', 'Shin Se Kyung', 'Byun Yo Han']",육룡이 나르샤
1279,The Merchant: Gaekju 2015,KBS2,['Kim Dong Hwi'],"['Jung Sung Hee', 'Lee Han Ho']",2015-09-23,2016-02-18,"Wednesday, Thursday",2015,41,88.0,"In late Joseon, a poor man named Cheon Bong Sam inherits a decrepit inn and honestly works his way up to becoming a powerful merchant. As tradesmen clash against the bureaucratic powers that attempt to oppress them by rigging bad deals, Bong Sam never loses sight of his humble beginnings as a peddler even after achieving great success and eventually shapes the way that industry and business are done in his time. ","['Jang Hyuk', 'Lee Deok Hwa', 'Han Chae Ah', 'Park Eun Hye', 'Kim Min Jung', 'Yoo Oh Sung']",장사의 신-객주 2015
1280,D-Day,jTBC,['Jang Yong Woo'],['Hwang Eun Kyung'],2015-09-18,2015-11-21,"Friday, Saturday",2015,20,195.0,"An unprecedented 6.5-magnitude earthquake has struck Seoul, destroying roads and buildings, and preventing ambulances from reaching victims. Woefully unprepared for such a massive disaster, Korea can only watch the desperate situation and listen to the pleading cries for help. Hae Sung, a competent surgeon, can’t resist doing everything he can to help the injured people during the emergency. This upsets his hospital and they put him on a blacklist, as his benevolent help is against the hospital's profit. Ddol Mi, beautiful and ambitious, chased money and fame as a doctor, but now wants to become a truly compassionate doctor after meeting Hae Sung. Woo Jin has been building a successful career as Korea’s rising doctor, but secretly, he truly cares about being a genuine doctor, saving the lives of the sick. These three characters team up to rush into emergencies, holding onto hope in the most desperate situations, and taking all sorts of risks for the sake of saving lives.(Source: JTBC)","['Kim Young Kwang', 'Lee Kyung Young', 'Jung So Min', 'Ha Seok Jin']",디데이
1281,She Was Pretty,MBC,['Jeong Dae Yun'],['Jo Sung Hee'],2015-09-16,2015-11-11,"Wednesday, Thursday",2015,16,225.0,"As a young girl, Hye Jin was impossibly cute and lived a comfortable life with her wealthy parents. Since entering her teens, both her looks and fortunes have drastically changed. She currently lives rent-free with a friend and is a part-time clerk at a convenience store. Out-of-the-blue, Sung Joon, her childhood friend, contacts her and suggests they meet. He is unaware that Hye Jin recently spotted him and knows how fit and handsome he had become. Not wanting to disappoint him, she insists her pretty best friend go in her place. What could go wrong?After landing a full-time job, Hye Jin is surprised to find out that Sung Joon is her boss. To add insult to injury, he is treating her with nothing but disdain and contempt. This is not the friend she fondly remembers, so she goes about hiding her true identity from him.  (Source: MBC)","['Choi Si Won', 'Hwang Jung Eum', 'Park Seo Joon', 'Go Joon Hee']",그녀는 예뻤다
1282,Love Cells Season 2,Naver TV Cast Viki,,,2015-09-14,2015-10-01,"Monday, Tuesday",2015,12,50.0,"In this bitter-sweet love story, Ne Bi acts as a navigator of the love relationship. She leads the way for the main characters to piece their long-lost memories of love together. ","['Jo Bo Ah', 'Kim Yoo Jung', 'Im Seul Ong']",연애세포 2
1283,Mobilize! K-Cop,,,,2015-09-07,2015-11-24,"Monday, Tuesday",2015,26,30.0,"By chance, two incumbent policemen rescued Princess Stella from an alien planet. The princess turned them from ordinary policemen into super-powered police officers. The alien villains, who followed the princess to Earth, found that they could use the negative energy of humans (i.e., greed, laziness, timidity, and fear) to awaken the black phoenix and conquer the entire universe. After the transformation, Police Kai needs to assist Princess Stella to find the ""fifth element"" on the earth, so as to defeat the dark forces, protect the earth, and maintain justice.(Source: Namu Wiki, Movie Douban)","['Jung Geun', 'Choi Jong Yoon']",출동! 케이캅
1284,Mom,MBC,"['Jang Joon Ho', 'Oh Kyung Hoon']",['Kim Jung Soo'],2015-09-05,2016-02-21,"Saturday, Sunday",2015,50,90.0,"For a long time, a mother has sacrificed herself to raise her four children but these children are only interested in her fortune and their possible inheritance. Stung by their betrayal and unacceptable behavior, she is determined to live the rest of her life to the fullest and be selfish for a change. This TV series will revolve around family values with themes of generational conflict and reconciliation. The revenge of a mother on her grownup children begins now!(Source: MBC)","['Jang Seo Hee', 'Lee Tae Sung', 'Cha Hwa Yun', 'Kim Suk Hoon', 'Choi Ye Seul']",엄마
1285,My Daughter Geum Sa Wol,MBC,"['Baek Ho Min', 'Lee Jae Jin']",['Kim Soon Ok'],2015-09-05,2016-02-28,"Saturday, Sunday",2015,51,88.0,"Geum Sa Wol is a genius architect who grew up in an orphanage. Despite the hardships she faced while growing up, she always stayed positive and never despaired no matter how tough life became. Her biological mother Deuk-ye had her through an extramarital affair with an ex-boyfriend and plots revenge on her husband and his mother. After a considerable amount of time has passed, Sa Wol meets her mother but both of them do not recognize each other. Instead, they get to know each other as mother-in-law and daughter-in-law.(Source: MBC)","['Yoon Hyun Min', 'Do Sang Woo', 'Son Chang Min', 'Park Se Young', 'Jeon In Hwa', 'Baek Jin Hee']","내 딸, 금사월"
1286,All is Well,KBS2,['Kim Won Yong'],['Lee Seon Hee'],2015-08-31,2016-01-29,"Monday, Tuesday, Wednesday, Thursday, Friday",2015,102,21.0,A drama about people who face hate and conflict while learning to forgive and understand the meaning of love and happiness. ,"['Choi Yoon Young', 'Kwak Shi Yang', 'Uhm Hyun Kyung', 'Han Bo Reum', 'Song  Jae Hee', 'Heo Jung Min']",都挺好
1287,TV Novel: The Stars are Shining,KBS2,['Kwon Gye Hong'],,2015-08-31,2016-02-26,"Monday, Tuesday, Wednesday, Thursday, Friday",2015,128,19.0,Jo Bong Hee's family falls into difficulties after the death of her father. She overcomes obstacles to become the best fashion designer in South Korea. ,"['Go Won Hee', 'Cha Do Jin', 'Lee Ha Yul', 'Seo Yoon Ah']",TV소설 별이 되어 빛나리
1288,Twenty Again,tvN,['Kim Hyung Shik'],['So Hyun Kyung'],2015-08-28,2015-10-17,"Friday, Saturday",2015,16,232.0,"38-year-old Ha No Ra dreamt of becoming a dancer in her high school years but met her husband, Kim Woo Chul, when she was 19. After having a child, she focused on taking care of her family and had to give up her dreams. In hopes of becoming a proud wife and mother to her college professor husband and her son Min Soo, she strives to enter college and ends up getting accepted into the same college as her son.(Source: AsianWiki)","['Lee Sang Yoon', 'Choi Won Young', 'Choi Ji Woo']",두번째 스무살
1289,Cheo Yong Season 2,OCN,['Kang Cheol Woo'],['Hong Seung Hyun'],2015-08-23,2015-10-18,Sunday,2015,10,450.0,Detective Cheo Yong uses his abilities to interact with spirits to solve cases. ,"['Jeon Hyo Sung', 'Oh Ji Ho', 'Ha Yun Joo']",처용2
