Unnamed: 0,drama_name,org_net,director,screenwriter,start_dt,end_dt,aired_on,year,tot_eps,time_per_ep,synopsis,actor_list,kor_title
1325,Jumping Girl,Daum Kakao TV,,,2015-04-27,2015-04-28,"Monday, Tuesday",2015,15,40.0,"Follows the life of Nam Sang Ah, who becomes the target of public criticism due to a sudden mistake.How in the world can this happen? Nam Sang Ah is an ordinary girl. But her life is turned upside down when she mistakenly becomes the victim of a public witch hunt. Her friends, Han Ga Eul and Lee Yenny, try to help Sang Ah. But Yenny also is busy working as the personal bodyguard to Seo Ah Shin, a top idol star who is hiding a vulnerable side. Can Gong Joo Ri, who has survived her own witch hunt in the past, help Sang Ah through this crisis and reclaim her life?(Source: Viki)","['Luna', 'U-kwon', 'Hana', 'B-Bomb']",점핑걸
1326,Who Are You: School 2015,KBS2,"['Baek Sang Hoon', 'Kim Seong Yoon']","['Kim Hyun Jung', 'Im Ye Jin', 'Kim Min Jung']",2015-04-27,2015-06-16,"Monday, Tuesday",2015,16,225.0,"Sekang High School is the most prestigious private high school in Seoul's Gangnam District, and Go Eun Byul is the most popular girl there. Meanwhile, her identical twin Lee Eun Bi is living in an orphanage and is being bullied at school. Then one day, Eun Byul mysteriously disappears. Soon after, Eun Bi loses her memories and is mistaken as being Eun Byul. Eun Bi then starts living her life as Eun Byul.(Source: Wikipedia)","['Yook Sung Jae', 'Nam Joo Hyuk', 'Kim So Hyun']",후아유: 학교 2015
1327,Make a Woman Cry,MBC,"['Kim Keun Hong', 'Park Sang Hoon']",['Ha Chung Ok'],2015-04-18,2015-08-30,"Saturday, Sunday",2015,40,112.0,One difference that separates humans from animals is that people have emotions. So describing the emotions of different characters in a TV drama is an important part of the storytelling process. What is it like for a person to love another person? What is it like for a person to forgive another? This TV drama is made with the premise of influencing people to become gentler and stronger human beings.(Source: MBC) ,"['Kim Jung Eun', 'Ha Hee Ra', 'Lee Tae Ran', 'Song Chang Eui', 'Oh Dae Gyu']",여자를 울려
1328,Divorce Lawyer in Love,SBS,['Park Yong Soon'],,2015-04-18,2015-06-14,"Saturday, Sunday",2015,18,213.0,"Go Cheok Hee and So Jeong Woo once worked together at a law firm; she was a divorce lawyer, and he was her office manager. She treated him like her inferior, while he constantly irked her by pointing out her mistakes and calling her ""Chucky"" behind her back. But Cheok Hee is so ambitious, so determined to win every case for her clients, that her unethical misdeeds catch up to her, causing her license to be suspended.Meanwhile, Jeong Woo studies and gets his law degree. Years later, they end up working together again for a different law firm. But this time, the tables have turned: he's the divorce lawyer, and she's the office manager. And Jeong Woo relishes getting his petty revenge.(Source: Wikipedia)","['Yeon Woo Jin', 'Cho Yeo Jung', 'Shim Hyung Tak', 'Wang Ji Won']",이혼변호사는 연애 중
1329,Splendid Politics,MBC,"['Kim Sang Ho', 'Choi Jung Gyu']",['Kim Yi Young'],2015-04-13,2015-09-29,"Monday, Tuesday",2015,50,72.0,"Princess Jung Myung was the only direct descendant of King Seon Jo still alive and when she was born, her birth was celebrated around the palace. She had the sweetest smile a baby could have. Queen In Mok was relieved that she had a baby girl instead of a boy. According to the seer Nam Sa Go, the baby she carried would become the true ruler of the Joseon Dynasty, a king of kings and have a princess proved the prophecy to be wrong. But the turbulent times took a heavy toll on Princess Jung Myung. Upon the death of King Seon Jo, Gwang Hae ascended the throne and his first order of business was to eliminate Prince Yeong Chang and banish Queen In Mok from the palace. Then his next target was Princess Jung Myung. When In Mok learned that her daughter’s life was in danger, she sent her into hiding. But assassins tracked Jung Myung down. Through the heroic sacrifice of her bodyguard, Jung Myung was put on a boat that sailed adrift in the sea. Meanwhile, the bodyguard and nanny set their boat ablaze and died to fool the assassins. Jung Myung witnessed her nanny and bodyguard consumed by the flames. Adrift on the boat, Jung Myung lost consciousness and was picked up by a merchant boat crossing to Dejima in Japan. She was sold as a slave. To survive in the hostile environment she hid the fact that she was a princess. She also vanquished her memories of ever being a princess so that she could focus on how to get revenge. Posing as a boy, Jung Myung worked as a laborer in the sulfur mine. But she discovered hope in the depths of her despair. It was a friendship between Ja Gyung that helped her cling to life. But she never lost her focus on returning to Joseon one day and bringing the downfall of Gwang Hae who had taken everything away from her. Then an opportunity arose. She began peddling information and secrets in the sulfur mines. Leveraging her strategic location, she followed the Joseon delegation visiting Japan back to Joseon. Finally, her dream to return to Joseon had come true…(Source: MBC)","['Kim Jae Won', 'Lee Yun Hee', 'Cha Seung Won', 'Seo Kang Joon']",화정
1330,The Superman Age,tvN,,['Yoo Byung Jae'],2015-04-10,2015-05-29,Friday,2015,16,112.0,"A male engineering student gains supernatural powers after turning 25. As soon as his friends find out about his abilities, they start taking advantage of him to improve their personal careers and love lives. ","['Lee Yi Kyung', 'Yoo Byung Jae', 'Kim Chang Hwan']",초인시대
1331,My Unfortunate Boyfriend,MBC Dramanet,['Nam Ki Hoon'],['Lee Jae Yoon'],2015-04-10,2015-05-30,"Friday, Saturday",2015,16,188.0,"Yoon Tae Woon is a man who believes in living truthfully, so he is honest to a fault. On the other hand, Yoo Ji Na is a woman who has no qualms about lying to get what she wants. She is just starting out at a corporate job, determined to succeed at any cost. The drama will demonstrate how their unlikely romance turns out to be true love. ","['Noh Min Woo', 'Han Hye Rin', 'Yang  Jin Sung', 'Jung Yoon Hak']",나의 유감스러운 남자친구
1332,Love on a Rooftop,KBS2,['Choi Ji Yeong'],"['Choi Min Ki', 'Kim Ji Wan']",2015-04-06,2015-08-21,"Monday, Tuesday, Wednesday, Thursday, Friday",2015,101,21.0,A drama about a woman who finally becomes a part of a family after re-adoption and man who chooses love over family. ,"['Park Jin Woo', 'Im Se Mi', 'Ham Eun Jung']",오늘부터 사랑해
1333,Let's Eat Season 2,tvN,"['Park Joon Hwa', 'Choi Kyu Shik']",,2015-04-06,2015-06-02,"Monday, Tuesday",2015,18,217.0,"The second season follows Goon Dae Yeong's character as he moves to a new building and reunites with his grade school classmate Baek Soo Ji. She’s been living alone for ten years, which means she’ll have plenty of her own single-living tips and opinions about food, setting her up to have a contentious relationship with Yoon Doo Joon.She’s a freelance writer with a crush on her other neighbor, Lee Sang Woo. He’s a civil servant who lives simply and eats simply. The sequel comes from the same PD-writer team that brought us the first season and promises another round of neighborly hijinks and, of course, lots and lots of food.","['Kwon Yool', 'Seo Hyun Jin', 'Yoon Doo Joon']",식샤를 합시다 2
1334,Falling for Innocence,jTBC,['Ji Young Soo'],['Yoo Hee Kyung'],2015-04-03,2015-05-23,"Friday, Saturday",2015,16,225.0,"Min Ho is a cold-blooded investment banker at Gold Investments. As a cynical, defensive, suspicious sociopath, he wears people down with his tenacity, taking advantage of them using his delusions of grandeur.  Min Ho has a different view of himself. He went through much when he was younger - his father's sudden death left his company open to a hostile takeover by his uncle, leaving him and his mother both destitute.  Min Ho  has a heart attack but miraculously survives after undergoing a heart transplant. Thanks to the new heart, he is no longer the cold and callous person he once was. Gradually he embraces happiness as he falls in love with Kim Soon Jung, who he wants to cherish and protect. But he’s not the only one vying for her attention.  Is Min Ho prepared to fight for what he wants?(Source: JTBC)","['Kim So Yeon', 'Yoon Hyun Min', 'Jung Kyung Ho']",순정에 반하다
1335,The Lover,Mnet,['Kim Tae Eun'],['Kim Min Seok'],2015-04-02,2015-06-25,Thursday,2015,12,250.0,"The series talk about four different couples living together in one apartment complex. Both in their thirties, Oh Do Shi is a voice actor and Ryu Du Ri is a blogger. They simply chose to live together instead of getting married, and have been sharing an apartment for two years. Jeong Yeong Jun and Choi Ji Nyeo are a couple that's twelve years apart in age. Ji Nyeo has the personality of a penny-pinching ajumma and basically supports her younger boyfriend in the hope that he will someday realize his dream, while Yeong Jun is an unemployed musician who carries around a guitar he doesn't know how to play. They've been living together for a year, and are quick to fight and make up. Park Hwan Jong and Ha Seol Eun are in their twenties and have just moved in together. Seol Eun wants her boyfriend to believe that she's the perfect embodiment of femininity, and works tirelessly to keep up the illusion. Lee Jun Jae is a loner who prefers to stay at home, but is forced to find a roommate for financial reasons. He doesn't even want to exchange unnecessary small talk so he advertises for a foreigner who can't speak Korean very well. Enter Takuya, a Japanese guy on his travels. Takuya thinks Jun Jae is wasting his youth, and begins to draw him out into the world.","['Oh Jung Se', 'Ryu Hyun Kyung', 'Choi Yeo Jin', 'Lee  Jae Joon', 'Jung Joon Young', 'Terada Takuya']",더 러버
1336,The Girl Who Sees Scents,SBS,['Baek Soo Chan'],['Lee Hee Myung'],2015-04-01,2015-05-21,"Wednesday, Thursday",2015,16,225.0,"Officer Choi Moo Gak lost his younger sister to a barcode-murder case and lost his ability to taste, smell, and feel pain. He then meets a girl named Oh Cho Rim, who is the only witness to the murder case and possesses a special sixth sense, which is the ability to see smells. ~~ Adapted from the webtoon ""Naemsaereul Boneun Sonyeo"" by Man Chwi. ","['Namkoong Min', 'Yoon Jin Seo', 'Shin Se Kyung', 'Park Yoo Chun']",냄새를 보는 소녀
1337,Missing Noir M,OCN,['Lee Seung Young'],['Lee Yoo Jin'],2015-03-28,2015-05-30,Saturday,2015,10,420.0,"Gil Su Hyeon is extremely intelligent. At the age of 10, he attended Harvard University and after graduating, he went to work at the FBI. 10 years later, he decided to come back to South Korea. He now works as the leader of the Special Missing Persons Unit. The unit deals with about 1% of special missing cases involving violent crimes. His appearance borders on perfection, but he holds a secret. Detective Oh Dae Yeong joins the Special Missing Persons Unit. He has worked as a detective for 20 years and he has an obsession in observing the law. He is known as a master of missing person cases.(Source: MUBI)","['Park Hee Soon', 'Jo Bo Ah', 'Kim Kang Woo']",실종느와르 M
1338,Angry Mom,MBC,['Ashbun'],['Kim Ban Di'],2015-03-18,2015-05-07,"Wednesday, Thursday",2015,16,262.0,"The protagonist, Jo Kang Ja was once legendary for being the toughest, most feared troublemaker at her high school in Busan. Due to her pregnancy in her late teens, she drops out of school and tries to become a responsible mother to her daughter, Oh Ah Ran. Fast-forward to the present, Kang Ja is now 34 years old and Ah Ran is a teenager attending high school. The two have a contentious relationship, with Ah Ran ashamed of Kang Ja's unrefined ajumma manners.Meanwhile, in Myungsung High School, when Ah Ran befriends the class outcast Jin Yi Kyung, it makes her the target of the school bullies who make her life hell, yet she's too proud to tell her mother what's happening. When Kang Ja finds out that her daughter is getting bullied, she decides to take matters into her own hands. Unbeknownst to Ah Ran, Kang Ja enrolls in Myungsung High as an undercover student with the false name ""Jo Bang Wool"" to teach those bullies a lesson. But she ends up unraveling the darker problems within the educational system. Kang Ja makes it her mission to put a stop to the school violence, dig up the flaws of the education system, and school corruption at Myungsung High with the help of Ah Ran and naive, idealistic homeroom teacher Park No Ah.(Source: Wikipedia)","['Kim Hee Sun', 'Ji Hyun Woo', 'Kim Yoo Jung']",앵그리맘
1339,Flower of the Queen,MBC,"['Kim Min Shik', 'Lee Dae Young']",['Park Hyun Joo'],2015-03-14,2015-08-30,"Saturday, Sunday",2015,50,78.0,"South Korean society values success more than anything else. People tirelessly strive to get ahead. Meanwhile, South Korea ranks at the bottom of the list of happy countries in the world. Korea's suicide rate is the highest among developed countries and the third highest in the entire world… There are things that money cannot buy. Money does not bring honor. Power cannot make one happy. Happiness is more powerful than political power, more valuable than riches, and a step above honor.  One mother chases success to live a luxurious lifestyle. A daughter finds success after practically raising herself. Two men love these two women as they pursue happiness. This TV series raises the question of what defines happiness to viewers.(Source: MBC)","['Lee Jong Hyuk', 'Yoon Park', 'Lee Sung Kyung', 'Kim Sung Ryung']",여왕의 꽃
1340,Super Daddy Yeol,tvN,['Song Hyun Wook'],,2015-03-13,2015-05-02,"Friday, Saturday",2015,16,244.0,"Doctor Cha Mi Rae with one daughter. One day, she is diagnosed with a rare cancer and informed she has about one year to live. She then seeks out her first love Kim Yeol. For her daughter, she struggles to turn Yeol into the best father possible. ","['Lee Dong Gun', 'Lee Yoo Ri', 'Lee Re']",슈퍼대디 열
1341,TV Novel: In Still Green Days,KBS2,"['Jun Chang Geun', 'Uh Soo Sun']",['Kim Ji Soo'],2015-03-02,2015-08-28,"Monday, Tuesday, Wednesday, Thursday, Friday",2015,129,16.0,A drama depicting coming-of-age story of a woman during the turbulent time in the seventies. ,"['Song  Ha Yoon', 'Jung Yi Yeon', 'Lee Hae Woo', 'Kim Min Soo']",TV소설 그래도 푸르른 날에
1342,Unkind Women,KBS2,"['Han Sang Woo', 'Yoo Hyun Ki']",['Kim In Young'],2015-02-25,2015-05-14,"Wednesday, Thursday",2015,24,175.0,"The drama is about four women spanning three generations in one household, who share the same hot-blooded temperament.Thirty years ago, when her husband passed away in an accident, Kang Sunok raised her teenage daughters alone. She became famous for her cooking classes with the help of a talented young disciple named Park Eunsil. The oldest daughter, Hyeonjeong, eventually became a well-known news presenter. She has worked hard and never married, but as the story starts, changes are about to come as her boss favours younger women. Sunoks second daughter, Hyunsuk, cared more about pop music than about schoolwork, and stirred up intense dislike within her teacher. She got expelled from school due to a series of events, got married and had a daughter, Jeong Mari, at a young age. She made her child’s success her life’s priority and Mari studied hard to get her PhD in Korean literature before the age of 30.As the drama starts, Hyunsuk is desperate to make more money to help her family, but things don’t go well. She happens to befriend a wealthy woman, Jang Moran, who becomes deeply involved with the family. Moran is elegant and rich, but she has kept a secret for 30 years – but can, or should, secrets be kept forever? Jang Moran isn’t the only woman to enter the struggling family’s life. Na Hyeonae, winner of the Teacher of the Year award and a doting mother, and none other than the person who ruined Hyunsuk’s life, shows up. Hyunsuk makes a promise to herself to force an apology out of this woman – a mission that turns out not to be so easy. In the meantime, Hyunsuk’s estranged husband does his best to quietly help, while three men with the same family name, Lee, also become important parts of the women’s lives.","['Lee  Ha Na', 'Do Ji Won', 'Chae Shi Ra', 'Kim Hye Ja']",착하지 않은 여자들
1343,Heard It Through the Grapevine,SBS,['Ahn Pan Seok'],['Jung Sung Joo'],2015-02-23,2015-06-02,"Monday, Tuesday",2015,30,120.0,"Han Jeong Ho and Choi Yeon Hee are a wealthy couple from a prestigious family. Their reputation is suddenly turned upside down when their teenage son, Han In Sang, impregnates his girlfriend, Seo Bom, who is from an ordinary family. Bom is determined to endure being isolated from her own family and humiliation from her in-laws for the sake of her child's future, while In Sang struggles between his love for Bom and his family's high expectations.","['Yoo  Joon Sang', 'Lee Joon', 'Go Ah Sung', 'Yoo Ho Jung']",풍문으로 들었소
1344,House of Bluebird,KBS2,['Ji Byung Hyun'],"['Choi Hyun Kyung', 'Park Pil Joo']",2015-02-21,2015-08-09,"Saturday, Sunday",2015,50,72.0,"A drama that tells the story of strong bond between the members of a family even though they are not blood-related. This drama also portrays the hope of parents toward their children’s success and how difficult for fresh university graduates to get respectable and well-paid jobs.Kim Ji Wan plays a reliable young man who brims with confidence. Meanwhile, Han Eun Soo plays a young woman with a bright personality. ","['Kyung Soo Jin', 'Chae Soo Bin', 'Lee Sang Yeob', 'Lee Joon Hyuk']",파랑새의 집
1345,Blood,KBS2,"['Lee Jae Hoon', 'Ki Min Soo']",['Park Jae Bum'],2015-02-16,2015-04-21,"Monday, Tuesday",2015,20,195.0,"Park Ji Sang is a doctor specializing in hepato-pancreato-biliary surgery in the best cancer research hospital in the country. He is also a vampire. Despite seeming cold and unfeeling, Ji Sang masks his soft heart and inner pain and yearns for closeness with people. He believes very strongly in the sanctity of human life and suppresses his thirst for blood to treat terminally ill patients and save lives.Among his colleagues is Yoo Ri Ta, a hotshot physician who entered medical school at the age of 17 and is also the niece of the chaebol group chairman who owns the hospital. Ri Ta is highly capable but snooty and prideful, yet Ji Sang finds himself falling for her. He also gets drawn into a conflict between good and evil as he encounters Lee Jae Wook, a two-faced hospital chief who gains everyone's trust with his gentle demeanor, but inwardly harbors a dangerous ambition for power and a talent for cruelty.(Source: Wikipedia)","['Ji Jin Hee', 'Ahn Jae Hyun', 'Gu Hye Seon']",블러드
1346,The Jingbirok: A Memoir of Imjin War,KBS1,"['Kim Sang Hwi', 'Kim Young Jo']",['Jung Hyung Soo'],2015-02-14,2015-08-02,"Saturday, Sunday",2015,50,60.0,"The drama will be a telling of historical events with the scholar as the central character. Ryu Seong Ryong was an official who served during King Seon Jo’s reign in the late 16th century. He was a brilliant Confucian scholar who was put in charge of military operations during the Imjin War, and greatly influenced Admiral Lee Soon Shin. The story starts before the Imjin War begins and will follow the characters all the way through the Battle of Noryang, and the death of Lee Soon Shin.","['Kim Tae Woo', 'Kim Sang Joong']",징비록
1347,Ho Goo's Love,tvN,['Pyo Min Soo'],['Yoon Nan Joong'],2015-02-09,2015-03-31,"Monday, Tuesday",2015,16,225.0,"Ho Goo has never dated in his life. He runs into his first love Do Hee. She is a member of the national swimming team and has a burning desire to win. She also talks like one of the guys. After Ho Goo meets Do Hee again, he becomes involved in a complicated romantic relationship and a dangerous friendship.~~ Adapted from the webtoon by Yoo Hyun Sook. ","['Lee Soo Kyung', 'Uee', 'Choi  Woo Shik', 'Im Seul Ong']",호구의 사랑
1348,Miss Mamma Mia,KBS1,['Kim Jong Chang'],['Park Sung Jin'],2015-01-28,2015-03-12,"Wednesday, Thursday",2015,12,300.0,"The drama’s about a young single mother raising a five-year-old daughter on her own, maintaining a positive attitude while working part-time jobs. ","['Han Go Eun', 'Kang  Byul', 'Seo Do Young', 'Shim Hyung Tak']",MISS 맘마미아
1349,"Hyde, Jekyll, Me",SBS,"['Jo Young Kwang', 'Park Shin Woo']",['Kim Ji Woon'],2015-01-21,2015-03-26,"Wednesday, Thursday",2015,20,180.0,"Gu Seo Jin is a third-generation chaebol who runs the theme park Wonder Land. He seemingly has everything — looks, brains, and fortune. But a traumatic incident in his childhood resulted in Seo Jin having a split personality — one is a cold, ruthless man, while the other is the polar opposite, someone kind and gentle. Because of this, he vows never to date or marry. Seo Jin wants to get rid of the circus show at Wonder Land due to low ticket sales and high overhead costs, but he butts heads with circus master Jang Ha Na. Ha Na insists on saving the failing circus and dreams of revamping it back to its former glory. She soon finds herself falling for both of Seo Jin's personalities. (Source: AsianWiki)~~ Adapted from the webtoon ""Dr. Jekyll is Mr. Hyde"" (지킬박사는 하이드씨!) by Lee Chung Ho (이충호).","['Sung Joon', 'Lee Hye Ri', 'Han Ji Min', 'Hyun Bin']","하이드 지킬, 나"
1350,Shine or Go Crazy,MBC,"['Song Hyung Suk', 'Yoon Ji Hoon']","['Kim Sun Mi', 'Kim Sun Young']",2015-01-19,2015-04-07,"Monday, Tuesday",2015,24,162.0,"Wang So, a Goryeo prince, was born with the name, “Shine.” Shin Yul is a woman hailing from the Balhae kingdom and believed to have the powers of an oracle. A prince who suffered vile remarks because of a cursed prophecy finds himself attracted to a former princess from a fallen kingdom who faces death because of her fate to become the light of another kingdom. Their love is at a point of either shining or flaming out.(Source: MBC)","['Jang Hyuk', 'Im Joo Hwan', 'Oh Yeon Seo', 'Na In Woo', 'Lee Ha Nee', 'Ryu Seung Soo']",빛나거나 미치거나
1351,My Heart Twinkle Twinkle,SBS,['Kim Yoo Jin'],['Jo Jung Seon'],2015-01-17,2015-04-12,"Saturday, Sunday",2015,26,162.0,"Soon Jin's father owns chicken restaurant Jinshim. She has two younger sisters: Soon Soo and Soon Jung. Since her mother died, Soon Jin has taken care of her father and her two younger sisters. She now also runs their chicken restaurant Jinshim. Soon Jin must worry about rival chicken restaurant, Woontak, run by a cold-blooded man.Soon Soo is the middle daughter. She has an attractive appearance and plays the piano well. Due to breaking up with her first love and her poor family background, she feels miserable.Soon Jung is the youngest daughter. She is proud of her father. She becomes involved with two men: Soon Cheol and Do Hoon.","['Jang Shin Young', 'Bae Soo Bin', 'Lee Tae Im', 'Nam Bo Ra']",내 마음 반짝반짝
1352,Spy,KBS2,['Park Hyun Suk'],"['Han Sang Woon', 'Lee Kang']",2015-01-09,2015-03-06,Friday,2015,16,188.0,"Hye Rim is a perfect mom inside and out. She pays a lot of attention to her children’s education. She’s also a perfect housewife who supports her husband very well. But in fact, she’s a former North Korean informant.Out of the blue, she’s assigned the mission of recruiting her son, who works for the National Intelligence Service (NIS), into espionage activity. In order to protect her son, she can do anything, even gamble her life.","['Go Sung Hee', 'Bae Jong Ok', 'Yoo Oh Sung', 'Kim Jae Joong']",스파이
1353,"Persevere, Goo Hae Ra",Mnet,"['Kim Yong Bum', 'An Joon Young']","['Jung Soo Hyun', 'Shin Myung Jin']",2015-01-09,2015-03-27,Friday,2015,12,375.0,"Goo Hae Ra, who is an aspiring musician is seeking stardom. She wishes to release the music of her deceased father but faces numerous obstacles. Hae Ra is then joined by twin brothers in her quest for stardom, on the musical competition show ""Superstar K2"".(Source: IMDb) ","['Jung Jin Young', 'Kwak Shi Yang', 'Min Hyo Rin']",칠전팔기 구해라
1354,Heart to Heart,tvN,['Lee Yoon Jung'],['Lee Jung Ah'],2015-01-09,2015-03-07,"Friday, Saturday",2015,16,225.0,"Cha Hong Do suffers from social phobia and has a problem with severe blushing. She does have a strong sense of curiosity and learns from books and the internet. One day, her grandmother, Cha Hong Do's only contact with the outside world, dies. She then begins doing housework as a maid, but disguises herself as an elderly woman. Through an incident, she meets a psychiatrist, Ko Yi Seok. ","['Lee Jae Yoon', 'Choi Kang Hee', 'Chun Jung Myung']",하트 투 하트
1355,"Kill Me, Heal Me",MBC,"['Kim Jin Man', 'Kim Dae Jin']",['Jin Soo Wan'],2015-01-07,2015-03-12,"Wednesday, Thursday",2015,20,186.0,"A traumatic childhood experience leaves Cha Do Hyeon, suffering from memory loss and dissociation. The latter has resulted in the creation of seven distinct personalities. Wanting to regain control over his life, he asks Oh Ri Jin, a first-year psychiatric resident, to help him, but she eventually falls in love with one of his personalities. Ri Jin’s twin brother, Oh Ri On, a famous mystery novelist, investigates Do Hyeon and his family. (Source: MyDramaList)","['Kim Yoo Ri', 'Ji Sung', 'Oh Min Suk', 'Hwang Jung Eum', 'Park Seo Joon']",킬미힐미
