Unnamed: 0,drama_name,org_net,director,screenwriter,start_dt,end_dt,aired_on,year,tot_eps,time_per_ep,synopsis,actor_list,kor_title
1181,TV Novel: That Sun in the Sky,KBS2,['Kim Shin Il'],"['Kim Ji Wan', 'Lee Jin Suk']",2016-09-07,2017-02-22,"Monday, Tuesday, Wednesday, Thursday, Friday",2016,121,18.0,A girl from the 1970s countryside overcomes all obstacles and becomes Korea's best actress. ,"['Yoon Ah Jung', 'Kim Hye Ji', 'Lee Min Woo', 'Noh Young Hak']",TV소설 저 하늘에 태양이
1182,Drinking Solo,tvN,"['Choi Kyu Shik', 'Jung Hyung Geon']","['Baek Sun Woo', 'Myung Soo Hyun', 'Choi Bo Rim']",2016-09-05,2016-10-25,"Monday, Tuesday",2016,16,240.0,"The story depicts people drinking alcohol alone for different reasons and the romance between Jin Jeong Seok and Park Ha Na. They both work at a private institute for people preparing for their civil service examinations in Noryangjin, Seoul. He is an arrogant, but popular instructor and she is a rookie instructor who struggles to survive in the private institute world. ","['Park Ha Sun', 'Ha Seok Jin']",혼술남녀
1183,Fantastic,jTBC,['Jo Nam Gook'],['Lee Sung Eun'],2016-09-02,2016-10-22,"Friday, Saturday",2016,16,225.0,"As a hardworking scriptwriter, So Hye is writing a drama about cancer when coincidentally she is diagnosed with breast cancer and learns she has five months left to live. She decides to live it up, leave no regrets, and do whatever she feels like doing. However, as a workaholic, she also commits to finishing her last project, then plans to leave quietly. But Hae Sung, a famous star, and her first love, suddenly shows up and her plans fall through. So Hye is actively opposed to casting Hae Sung as the lead in her latest drama. His stiff, robotic acting and constant nagging annoy her, and they occasionally have petty fights. But along the way, they actually seem to be falling in love. Meanwhile, Joon Ki has been by her side, both as her doctor and a friend. He knows So Hye’s bright demeanor sometimes acts as a cover for her secret burden. He knows her well, and he’s been through it himself. Though he can’t cure her, he wants to be her steady soulmate, and face the reality together. Joon Ki and Hae Sung fight for So Hye’s love, and with mixed emotions, she is indecisive. How can she decide when she only has a few months left? What is the best way to leave without regrets?(Source: JTBC)","['Joo Sang Wook', 'Kim Hyun Joo', 'Kim Tae Hoon', 'Kim Ji Soo', 'Park Shi Yeon']",판타스틱
1184,Moon Lovers: Scarlet Heart Ryeo,SBS,['Kim Kyu Tae'],['Jo Yoon Young'],2016-08-29,2016-11-01,"Monday, Tuesday",2016,20,180.0,"When a total eclipse of the sun takes place, Go Ha Jin is transported back in time to the start of the Goryeo Dynasty of Korea during King Taejo's rule. She wakes up in the body of the 16-year-old Hae Soo and finds herself living in the house of the 8th Prince Wang Wook, who is married to Hae Soo's cousin. She soon befriends several of the princes and meets the ostracized 4th Prince, Wang So. Although knowing she should not get involved in palace intrigues over the succession to the throne, she inadvertently becomes a pawn in the struggle, as several of the Princes fall in love with her. (Source: MyDramaList)~~ Adapted from the novel “Bu Bu Jing Xin” (步步惊心) by Tong Hua (桐华).~~ There are 2 versions of this series, please read the FAQ thread for more info.","['Kang Ha Neul', 'Lee Joon Gi', 'IU']",달의 연인 - 보보경심 려
1185,Our Gap Soon,SBS,['Boo Sung Chul'],['Moon Young Nam'],2016-08-27,2017-04-08,"Saturday, Sunday",2016,61,69.0,"Heo Gap Dol is an unemployed college graduate who has been trying to pass the civil service exam for years. His longtime girlfriend Shin Gap Soon supports him by doing several part-time jobs in the hope of him finally passing the exam and proposing to her.This drama depicts positively about various kind of marriage forms between the characters: a normal marriage, divorced couple, remarried couple, common-law marriage, and cohabitation couple. ","['Song Jae Rim', 'Kim So Eun']",우리 갑순이
1186,Blow Breeze,MBC,['Yoon Jae Moon'],['Kim Sa Kyung'],2016-08-27,2017-02-26,"Saturday, Sunday",2016,53,85.0,"A wealthy, elderly man who was born in North Korea and amassed a $100 million fortune in South Korea knows that his time is short. One day, he coincidentally learns that he had a son that he did not know of. The elderly man desperately tries to track down his son but learns that he died. However, the elderly man soon discovers that his son has a daughter who was also defected from North Korea and is currently living in South Korea. Now, the elderly man is seeking to find her whereabouts so that she can inherit his fortune. The story revolves around the long-lost family members and a South Korean man with a North Korean woman who is able to find love by overcoming their differences.(Source: MBC)","['Im Ji Yeon', 'Im Soo Hyang', 'Son Ho Jun', 'Oh Ji Eun', 'Han Joo Wan']",불어라 미풍아
1187,The Gentlemen of Wolgyesu Tailor Shop,KBS2,['Hwang In Hyuk'],['Goo Hyun Sook'],2016-08-27,2017-02-26,"Saturday, Sunday",2016,54,72.0,"Laurel Tree Tailor Shop is family-owned and has been in business for almost a century. Its master tailor, Lee Man Sool, has perfected the dying art of creating a made-to-measure suit. Man Sool departs, only leaving a note to his wife with instructions to sell the old-fashioned shop as the business is no longer viable and he just does not have the heart to do it himself. His wife, son, and daughter are all taken aback by his decision. His former apprentice is devastated by the news of Man Sool’s disappearance and contemplates the idea of returning to the shop, which his wife forbids.Family politics are at play when Dong Jin suddenly finds himself unseated as the president of his father-in-law’s company and his wife sues him for divorce. Dong Jin decides his best move is to return to his father’s tailor shop.The seamstresses want to keep the shop open until their boss’s return, but one lady is unsure as she keeps having negative experiences with Dong Jin.What will it take to save this beloved neighborhood shop?(Source: Viki)","['Lee Dong Gun', 'Ra Mi Ran', 'Hyun Woo', 'Choi Won Young', 'Jo Yoon Hee', 'Cha In Pyo']",월계수 양복점 신사들
1188,Jealousy Incarnate,SBS,['Park Shin Woo'],['Seo Sook Hyang'],2016-08-24,2016-11-10,"Wednesday, Thursday",2016,24,150.0,"Lee Hwa Shin is a handsome anchor with notable journalistic talent, a well-to-do family and commendable education. He is also as fierce a competitor as one will find in the world of reporting, and goes after stories relentlessly. But as luck would have it, he also comes across another fierce competitor -- meteorologist Pyo Na Ri. Pyo Na Ri doesn’t have the shining resume of her anchor counterpart, went to a third-rate college and only has a temporary contract with the station. Although her dorky exterior hides an inner fire, Na Ri has worked extremely hard to get where she is, even doing odd jobs like lifting boxes. Both anchor and meteorologist now see each other as rivals in their race to become the station’s most valued employee. But what happens when the two rivals start to fall in love? The drama may be too much, even for a broadcasting station.","['Go Kyung Pyo', 'Jo Jung Suk', 'Gong Hyo Jin']",질투의 화신
1189,Love in the Moonlight,KBS2,"['Baek Sang Hoon', 'Kim Seong Yoon']","['Im Ye Jin', 'Kim Min Jung']",2016-08-22,2016-10-18,"Monday, Tuesday",2016,18,197.0,"To protect herself and her family, Hong Ra On disguises herself as a man and counsels men on dating. Due to a love letter she wrote for a client, she meets Crown Prince Hyo Myung. Ra On is unaware that he is the Crown Prince, and Hyo Myung is unaware that Ra On is a woman. Soon after Ra On is forced to become a eunuch by loan sharks, and the Crown Prince and Ra On become interested in each other. As Ra On tries to survive the palace and the Crown Prince navigates his journey to become king, will their love prosper?(Source: MyDramaList)","['Jung Jin Young', 'Chae Soo Bin', 'Kwak Dong Yeon', 'Kim Yoo Jung', 'Park Bo Gum']",구르미 그린 달빛
1190,Cinderella and the Four Knights,tvN,"['Kwon Hyuk Chan', 'Lee Min Woo']","['Min Ji Eun', 'Won Young Shil', 'Lee Seung Jin']",2016-08-12,2016-10-01,"Friday, Saturday",2016,16,225.0,"Eun Ha Won is in her third year of high school with dreams of becoming a teacher. Unattached from her father, step-mother, and step-sister, and poorly treated by them, Ha Won still manages to maintain her bright personality and strong set of morals, working various part-time jobs to pay for her upcoming university tuition fees and keeping her eyes firmly glued to her goals.Meanwhile, in another part of the city are three spoiled cousins, Ji Woon, Hyun Min, and Seo Woo, living together in a mansion called Sky House. With their wildly different personalities - Ji Woon a tough guy, Hyun Min a playboy, and Seo Woo a musician - they all deeply dislike each other and prefer to be as far away from each other as possible.One day, their grandfather orders his 3 grandsons to attend his 5th wedding ceremony. Hyun Min doesn't want to go, but ultimately ends up hiring Ha Won to be his date for 3 hours so he can upstage his grandfather. His plans don't completely pan out, however, when the grandfather witnesses Ha Won's no-nonsense attitude towards Hyun Min and decides to hire her as a live-in butler and drill sergeant of sorts at Sky House. What follows is a lot of shenanigans, love triangles, drama, and plenty of sass.","['Son Na Eun', 'Jung Il Woo', 'Lee Jung Shin', 'Park So Dam', 'Ahn Jae Hyun', 'Choi Min']",신데렐라와 네 명의 기사
1191,Welcome to My Lab Season 2,Tooniverse,,,2016-08-02,2016-10-11,Tuesday,2016,11,273.0,,"['Yoo Jun', 'Park Si Eun', 'Jung Sung Young', 'Jung Taek Hyun']",내일은 실험왕 2
1192,Second to Last Love,SBS,['Choi Young Hoon'],['Choi Yoon Jung'],2016-07-30,2016-10-16,"Saturday, Sunday",2016,20,195.0,"An adult romance about a forty-something woman finding love and who works as a television producer. She has no interest in romance and just concerns herself with preparing for retirement, but when she moves to a new town, she meets a 46-year-old man who’s widowed and has one child, and a romance begins. ","['Ji Jin Hee', 'Kim Hee Ae', 'Kim Seul Gi', 'Kwak Shi Yang']",끝에서 두번째 사랑
1193,Tong: Memories,,,,"Jul 22, 2016","Jul 22, 2016",,2016,12,70.0,"What makes a young boy grow up to become a legendary fighter? Lee Jung Woo has always had a short temper and doesn’t like to be messed with. Growing up in Busan, he learns to fight back when he is bullied by other kids and ends up becoming a local legend and the top street fighter of Busan. His best friend is Kwon Doo Hyun, who always lives under the shadow of Jung Woo. “Tong: Memories” is a South Korean web movie. It is considered to be the prequel to the popular webtoon “Tong.”","['Lee Hak Joo', 'Heo Ji Won']",통: 메모리즈
1194,Age of Youth,jTBC,['Lee Tae Gon'],['Park Yeon Sun'],2016-07-22,2016-08-27,"Friday, Saturday",2016,12,300.0,"Five girls in their twenties come to live together in a house called ""Belle Epoque,"" which means ""a beautiful time"" in French. Each girl has a particular personality, background, and issues. In addition to the five girls, they believe there is a sixth presence - a ghost living in the house, but each sees the ghost differently. As the girls feel a bond of sympathy and become closer, they also deal with their personal issues as they live out their eventful twenties. The drama follows their struggles and incidents dealing with relationships - within their circles, with dating, and with each other - and a variety of events they are experiencing, including credits, part-time jobs, drinking, hopes and dreams.(Source: JTBC)","['Park Eun Bin', 'Park Hye Soo', 'Han Ye Ri', 'Han Seung Yeon', 'Ryu Hwa Young']",청춘시대
1195,W,MBC,['Jeong Dae Yun'],['Song Jae Jung'],2016-07-20,2016-09-14,"Wednesday, Thursday",2016,16,225.0,"Oh Sung Moo, the father of cardiothoracic surgeon Oh Yeon Joo, mysteriously goes missing while writing the last chapter of his webtoon ""W"". Yeon Joo goes to his office looking, but a hand from his monitor suddenly pulls her in, and she finds herself on the rooftop of a building, next to a bloodied man. She manages to save the person, only to realize that he is Kang Cheol, the main character of her father's webtoon. Yeon Joo later discovers she can only enter and leave the webtoon depending on Kang Cheol's feelings.(Source: MyDramaList)","['Lee Jong Suk', 'Han Hyo Joo']",더블유
1196,Horror Delivery Service,,,,"Jul 18, 2016","Jul 18, 2016",Monday,2016,7,43.0,"""Horror Delivery Service"" is a mini-thriller. Once in a while, everyone has eerie imaginations about things that could happen in familiar settings -- a family apartment, on an elevator, on the way home from class and by the relaxing river. In each stand-alone episode, those imaginations are turned into urban tales that shatter the peace and normality of everyday life. (Source: VIU) ",,호러 딜리버리 서비스
1197,Magic Cell Phone,,['Kwon Nam Ki'],,2016-07-13,2016-09-14,,2016,10,60.0,"The drama revolves around the romance between an ordinary guy and a girl group member.~~ The drama is a joint Korean-Chinese production, for a total of 5 parts. ","['Kim Jin Woo', 'Park Min Ji']",마법의 핸드폰
1198,"Bring It On, Ghost",tvN,['Park Joon Hwa'],['Lee Dae II'],2016-07-11,2016-08-30,"Monday, Tuesday",2016,16,225.0,"A cohabitation comedy about a ghost of a high school girl who has been dead for 5 years and an exorcist college boy with the ability to see and hear ghosts. What he’s discovered over the years is that he can touch them and fight them off, so when he’s in need of a part-time job and can’t find one that pays well enough, he starts putting ads online as an exorcist for hire. His ad: “Will face off with your ghosts. Chances of winning: virgin ghosts 80%, bachelor ghosts 40%, child ghosts 97%, the rest 50%.” One night he goes out on the job and faces off with a schoolgirl ghost, and during the fight, they accidentally kiss and sparks fly.~~ Adapted from the webtoon “Let's Fight, Ghost” (싸우자귀신아) by Iminsu (임인스).","['Kwon Yool', 'Ok Taec Yeon', 'Kim So Hyun']",싸우자귀신아
1199,The Good Wife,tvN,['Lee Jeong Hyo'],['Han Sang Woon'],2016-07-08,2016-08-27,"Friday, Saturday",2016,16,225.0,"A husband works as a successful prosecutor and his future appears bright, but he gets arrested for corruption in a political scandal. His wife who worked as an attorney prior to their marriage, now resumes her career after a 13 year hiatus. She begins to find her true identity.(Source: AsianWiki)~~ Remake of the American TV series ""The Good Wife"" [2009]. ","['Jeon Do Yeon', 'Yoo Ji Tae', 'Yoon Kye Sang']",굿 와이프
1200,Uncontrollably Fond,KBS2,"['Park Hyun Suk', 'Cha Young Hoon']",['Lee Kyung Hee'],2016-07-06,2016-09-08,"Wednesday, Thursday",2016,20,180.0,"People change but can the heart adapt? Sin Joon Young and No Eul were in love in their younger days. But uncontrollable circumstances separated them, and they went their separate ways. Joon Young is now a superstar actor and singer, while No Eul has become a producer-director of documentaries. When their paths cross again years later, Joon Young discovers that No Eul is now a very different person than he remembered — materialistic and willing to do anything to get ahead. Is there any hope for Joon Young and No Eul to rekindle their past relationship?(Source: Viki)","['Kim Woo Bin', 'Im Joo Hwan', 'Bae Suzy', 'Im Ju Eun']",함부로 애틋하게
1201,Go Ho's Starry Night,SBS Sohu TV,['Jo Soo Won'],['Shin Yoo Dam'],2016-07-02,2016-07-31,"Saturday, Sunday",2016,20,60.0,"The Starry Night is a Chinese-South Korean collaboration web drama.At twenty-nine-years-old, Go Ho faces the struggles of the modern day woman, namely the struggles to succeed in work and romance in the 21st Century. An advertisement contractor who is unlucky in love, Go Ho works hard to be successful with her career, and only thinks of romance as an afterthought. But one day, an old flame turns up, taking on the role of her new boss, and suddenly it seems like every man is looking her way. Will the dust settle long enough for her to make the right romantic choices?","['Kim Young Kwang', 'Kwon Yu Ri', 'Lee Ji Hoon']",고호의 별이 빛나는 밤에
1202,After the Show Ends,Naver TV Cast tvN,"['Son Chang Woo', 'Heo Chan']",['Jo Seong Geol'],2016-07-01,2016-08-19,Friday,2016,8,525.0,"A new concept of blend between virtual and reality, drama and variety. This show tells what happens between the actors of a TV drama, in the “real life” after they finish the everyday filming.It’s about a 20+ female office worker who has nothing special to recommend her and her non-ordinary double life.(Source: Koreandrama.org) ","['Ahn Bo Hyun', 'Yura', 'Ha Seok Jin', 'Yoon So Hee', 'Lee Min Hyuk']",연극이 끝나고 난 뒤
1203,Secrets of Women,KBS2,['Lee Kang Hyun'],['Song Jung Rim'],2016-06-27,2016-11-25,"Monday, Tuesday, Wednesday, Thursday, Friday",2016,104,20.0,"A woman who used to be as innocent as a white swan, turns into a black one to avenge her father and bring back her child that was taken from her. ","['Jung Heon', 'Oh Min Suk', 'Kim Yun Seo', 'So Yi Hyun']",여자의 비밀
1204,Wanted,SBS,['Park Yong Soon'],"['Han Ji Wan', 'Han Ji Wan']",2016-06-22,2016-08-18,"Wednesday, Thursday",2016,16,225.0,"Jung Hye In is a top actress in Korea who reigns over dramas, movies, and commercials. However, her son is kidnapped on the day she announces her retirement. With the help of PD Shin Dong Wook and police detective Cha Seung In, she ends up participating in a live reality show where she follows the kidnapper’s orders, and in the process uncovers clues towards catching the culprit and finding her son. ","['Park Hae Joon', 'Kim Ah Joong', 'Ji Hyun Woo', 'Uhm Tae Woong']",원티드
1205,Here Comes Love,SBS,['Bae Tae Seop'],['Kim In Kang'],2016-06-20,2016-12-09,"Monday, Tuesday, Wednesday, Thursday, Friday",2016,122,17.0,"A family drama about a woman who is hurt by love, striving for small happiness and realizing the preciousness of family. ","['Lee Min Young', 'Kim Ji Young', 'Go Se Won', 'Lee Hoon']",사랑이 오네요
1206,Doctors,SBS,['Oh Choong Hwan'],['Ha Myung Hee'],2016-06-20,2016-08-23,"Monday, Tuesday",2016,20,180.0,"Yoo Hye Jung was a tough bully in school with a prickly personality and always goes wayward. She had many scars from her childhood and through self-preservation, Hye Jung keeps her heart shut away from other people. However, she changes after meeting her mentor Hong Ji Hong who plays a key role in transforming her life from a helpless gangster to a compassionate doctor.(Source: iQiyi) ","['Lee Sung Kyung', 'Kim Rae Won', 'Yoon Kyun Sang', 'Park Shin Hye']",닥터스
1207,A Beautiful Mind,KBS2,"['Mo Wan Il', 'Lee Jae Hoon']",['Kim Tae Hee'],2016-06-20,2016-08-02,"Monday, Tuesday",2016,14,257.0,"Lee Yeong Oh is a genius neurosurgeon who just came back to Korea after finishing his studies abroad. He now works with his father, Lee Gun Myung, who is the head of the cardio-cerebrovascular center at Hyunsung hospital. However, Yeong Oh lacks empathy towards his patients due to his antisocial personality disorder.One day, traffic policewoman Gye Jin Sung sees a murder in front of her, which was disguised as a traffic accident. She rushes the victim to Hyunsung hospital, where her crush Surgeon Hyun Suk Joo, of the cardiothoracic section, and Surgeon Yeong Oh operate on him. Unfortunately, the patient dies and she starts suspecting Surgeon Yeong Oh of foul play. Meanwhile, a series of bizarre patient deaths start occurring at the hospital and Yeong Oh starts investigating it.(Source: MyDramaList)","['Jang Hyuk', 'Yoon Hyun Min', 'Park So Dam']",뷰티풀 마인드
1208,38 Task Force,OCN,['Han Dong Hwa'],['Han Jung Hoon'],2016-06-17,2016-08-06,"Friday, Saturday",2016,16,240.0,"A special task force will mix cops and criminals in order to catch bad guys, but this time the good-bad guys will be con artists who use their skills of fraud and deception in order to help catch tax evaders.While the working class faithfully pays its taxes, the wealthiest elite uses elaborate schemes to get out of paying their fair share of taxes. Righteous Baek Sung Il is a civil service employee who works as the Division 3 Chief at the National Tax Service who becomes fed up with the wealthiest citizens circumventing Article 38, which governs tax payments. Under pressure from his bosses to increase his division’s delinquent tax collections, Sung Il tries to go after the largest tax evader in the country, Ma Jin Seok, a shady Gangnam businessman who owes the country an estimated $50 million in back taxes. But when Sung Il and his faithful subordinate Chun Sung Hee are humiliated by Jin Seok and faced with possible disciplinary action, Sung Il realizes that he needs help going after the corrupt businessman. He accepts the help of professional scammer Yang Jung Do to beat Jin Seok at his own game.","['Choi Soo Young', 'Seo In Guk', 'Ma Dong Seok']",38사기동대
1209,28 Faces of the Moon,,,,2016-06-15,2016-06-16,Thursday,2016,8,75.0,A man’s life spirals downward after his fiance dies just days before their wedding. ,"['Kim Kyu Jong', 'Yang  Jin Sung']",28개의달
1210,You Are a Gift,SBS,['Yoon Ryu Hae'],['Oh Bo Hyun'],2016-06-13,2016-11-24,"Monday, Tuesday, Wednesday, Thursday, Friday",2016,111,22.0,"Hyun-Soo is a university student who is smart and bright, but has lived through a tragic past. Her father died in a motorcycle accident and her mother suffered brain damage in the accident. Hyun-Soo dates Yoon-Ho and they decide to marry. At first, his mother, Young-Ae, opposes their marriage, but relents. After their marriage, Yoon-Ho and his father get into an accident, his father dies and he goes missing. Unaware that Hyun-Soo is pregnant, her mother-in-law moves to another country without telling her. Years later, Hyun-Soo and Young-Ae meet again.","['Shim Ji Ho', 'Jin Ye Sol', 'Cha Do Jin', 'Heo Yi Jae']",당신은 선물
1211,Lucky Romance,MBC,['Kim Kyung Hee'],['Choi Yoon Kyo'],2016-05-25,2016-07-14,"Wednesday, Thursday",2016,16,225.0,"When a traffic accident leaves her younger sister in a coma with little chance of survival, Shim Bo Nui turns to superstition in her desperation to save her only remaining family member. Two years later, her sister is still unconscious and pronounced to have little time left to live. When a trusted fortuneteller tells her that the only way to help her sister is to spend a night with a man born in the Year of the Tiger, Bo Nui sets out to do just that, no matter the cost.Born in the Year of the Tiger is Je Su Ho, a genius who rose to the top with his inborn skills and hard work and is now the CEO of a top gaming company. Su ho has no interest in dating and wants nothing to do with superstitions. He only believes in science and mathematics; his only love is coding.When these two get entangled with each other, is it already a recipe for disaster, or the start of an improbable romance? And what will the return of a childhood friend and a first love mean for these two?(Source: MyDramaList)~~ Adapted from the webtoon series.","['Lee Chung Ah', 'Lee Soo Hyuk', 'Ryu Joon Yeol', 'Hwang Jung Eum']",운빨로맨스
1212,Under the Black Moonlight,SBS,,,2016-05-24,2016-05-26,Tuesday,2016,9,67.0,"The drama revolves about incidents that take place to an owner of a mountain cabin and his mother after a group of friends’ visit to the cabin. “Under Black Moonlight”, the first of the five series, is an unusual genre of mystery thriller. As it is known to have high-quality images and sophisticated story, “Under Black Moonlight” has drawn keen attention even from the stage of its scenario is written. ","['Kim Seo Ra', 'Nam Tae Hyun', 'Kim Soo Yeon']",검은 달빛 아래서
1213,Let's Make a New Start,MBC,"['Park Jae Bum', 'Jang Joon Ho']",['Won Young Ok'],2016-05-23,2016-11-18,"Monday, Tuesday, Wednesday, Thursday, Friday",2016,121,17.0,"Na Yeong Ja, an ordinary department store clerk, is entangled in a love triangle with the scion of a department store fortune and a top executive at the same department store. This TV series is like a Cinderella fairytale story but without a passive heroine who waits for a prince to bring her a glass shoe. Instead, the heroine of this show reaches her goal by proactively seizing opportunities and working hard to also find love in her personal life.(Source: MBC)","['Park Sun Ho', 'Park Min Ji', 'Go Woo Ri', 'Kim Jeong Hoon']",다시 시작해
1214,Beautiful Gong Shim,SBS,"['Baek Soo Chan', 'Nam Tae Jin']",['Lee Hee Myung'],2016-05-14,2016-07-17,"Saturday, Sunday",2016,20,180.0,"This drama is about the love story of two sisters and two men. The talented older sister has everything, including a beautiful appearance, and her younger sister,  who is less attractive but still has a warm heart. And two men appear in front of the siblings: a progressively more attractive man, who moved into a humble rental room on the rooftop of their building and another man who is handsome and wealthy from a plutocrat family. The romance-comedy drama depicts an eventful and unpredictable love story by the four people from such a warmhearted point of view.(Source: AsianWiki)","['Bang Min Ah', 'Namkoong Min', 'Ohn Joo Wan', 'Seo Hyo Rim']",미녀 공심이
