Unnamed: 0,drama_name,org_net,director,screenwriter,start_dt,end_dt,aired_on,year,tot_eps,time_per_ep,synopsis,actor_list,kor_title
269,Her Bucket List,Daum Kakao TV,,,"Dec 31, 2021","Dec 31, 2021",Friday,2021,10,120.0,"Very much in love with her boyfriend, Cha Ra Ri is devastated when she learns that he has unexpectedly passed away. Unsure how she can ever find the strength to go on living without him, Ra Ri decides to follow her boyfriend in death. But the discovery of a bucket list, which she had written with him ages ago, inspires her to hold off on death for just a while longer. Determined to fulfill every item of their shared bucket list, Ra Ri sets out to do just that. As she begins checking items off their list, she crosses paths with Kang Hansol, an idol trainee with great potential but terrible stage fright. Brought together by fate, Ra Ri and Hansol begin completing items on her bucket list together, their time together giving them the strength to hold on, just a while longer.Working their way through the list, Ra Ri and Hansol begin to realize there are unexpected feelings growing between them. Drawing ever closer, the pain they’ve both endured slowly begins to fade. Will their newfound feelings give them the strength they need to continue living despite everything?(Source: Viki)~~ Adapted from a webtoon of the same name.","['Na In Woo', 'Kim So Hye', 'Kim Woo Rin', 'Lim Se Jun']",그녀의 버킷리스트
270,The Man's Voice,iQiyi Viki,,['Kim Kyung Hee'],"Dec 30, 2021","Dec 30, 2021",Thursday,2021,8,225.0,"A fantasy rom-com about a convenience store part-timer who is searching for a full-time job, a handsome pilot, and his pet cat. The drama tells the story that unfolds when the shy female lead gains the ability to communicate with a cat she coincidentally meets and comes to make some sort of deal with the prickly cat. Baek Tae Hwa is the cat’s owner and an airline co-pilot. He has a good background and handsome looks that would make anyone fall for him. Due to his naturally sweet personality, Baek Tae Hwa has often made women cry without meaning to. The pet hotel he uses suddenly closes before his flight one day, so Baek Tae Hwa ends up entrusting his pet with a woman. Go Mi Rim has an ordinary background and is optimistic by nature. She works part-time at a convenience store while looking for a full-time job. Go Mi Rim agrees to take care of the cat owned by her one-sided love interest, but she starts to hear the cat’s voice after being hit by lightning, setting up the plot for an interesting romance to unfold.(Source: iQiyi)","['Choi  Tae Joon', 'Song Ji Eun', 'Sung Ji Ru']",그 놈 목소리
271,Behind Cut,,['Han Woo Im'],,2021-12-28,2022-01-19,"Tuesday, Wednesday",2021,8,112.0,"Ki Jin is a budding fashion design student who dreams big: He wants to become a world-famous clothing designer. But the journey to the top of South Korea’s fashion tree is not an easy one, and he is struggling to find the right path. One day, on the street, he bumps into Yeong Woo, an ever-optimistic part-time delivery worker. Even though it seems everyone he knows has formulated a grand plan about how their future will unfurl, Yeong Woo doesn’t have a dream. While all others are in a rush to get somewhere in life, it seems that his own life is stuck in first gear.Although things have got off to a decidedly shaky start for Ki Jin and Yeong Woo, they start to develop a fondness for one another, and start to wonder if their seemingly opposing blend of determinedness and acceptance could be a case of “opposites attract.” But when a leading model named Lee Bin arrives on the scene, things get complicated. He starts to develop a crush on Ki Jin. Could this development spell the end for the fledgling romance between Ki Jin and Yeong Woo?(Source: Viki)","['Bum Jun', 'Eom Se Ung']",비하인드 컷
272,Time of Memory,,,,2021-12-28,2022-01-01,,2021,20,30.0,"On the outside it may seem like Jung Woo Jin has everything a person could ever possibly want. With his natural talent, unparalleled looks, and a quick wit, he has become the nation’s fastest rising star. Whatever he touches is guaranteed to become the next big hit, making Woo Jin something of a national phenomenon. But behind this glittering exterior there lies a deeply hidden secret. Afflicted by a disease which makes him remember everything, Woo Jin is constantly bombarded by memories and emotions from the past.Unable to escape the moments in his life he’d give anything to be able to forget, Woo Jin lives in a hellish nightmare that stretches on forever. Unable to escape the past, Woo Jin is intrigued when he happens to cross paths with a woman who seems to be afflicted with an unusual condition of her own. Unable to remember anything that happened more than a month ago, Do Hae Soo lives her life from one moment to the next. With no way to remember anything that has happened in the past, Hae Soo has no choice but to live her life constantly moving forward. Intrigued by a woman who can’t ever seem to remember him, Woo Jin finds himself wanting to know more about her. Finding ways to be near her, Woo Jin and Hae Soo draw ever closer; but what future could they possibly have together when she never remembers and he never forgets?(Source: Viki)","['Lee Sung Yeol', 'Yoo Bin']",기억의 시간
273,Best Mistake Season 3,vLive,,,2021-12-27,2022-02-17,"Tuesday, Thursday",2021,16,94.0,"The new season will take place in a college setting, showing the growth and romance of young people as they prepare to enter the real world.","['Yoon Hyun Suk', 'Kang Hye Won', 'Lee Eun Jae', 'Kang Yul', 'Kim Won Pil']",일진에게 반했을 때
274,Love & Wish,Daum Kakao TV,,['Han Yoon Sun'],2021-12-24,2021-12-25,"Friday, Saturday",2021,9,107.0,"Son Da Eun, 17, is the youngest of three sisters. From an early age, she and her sisters would spend their time reading romance-themed comics and novels, and Son Da Eun would spend her nights dreaming of finding true love. Her family moves to the South Korean capital, Seoul, and she finds herself living next door to a handsome high schooler named Kim Seung Hyu. He is charming and attractive, and she feels that perhaps he might be her first true love.When she discovers that Kim Seung Hyu is actually her new classmate at the high school, she has just transferred to, and everything seems to be falling into place. Surely, she thinks, this is fate, and nothing could stand in the way of love now. But as she starts to get to know him better and settles into life at her new school, she realizes that he is holding something back from her: He has been the victim of cruel and vindictive school bullying that has left him emotionally vulnerable. Can love conquer all, or will the demons of his past derail their fledgling romance?(Source: Viki)~~ Adapted from the webtoon series ""Love & Wish"" (러브 앤 위시) written and illustrated by Inae.","['Choi Ye Bin', 'Choi Young Jae', 'Yoo Jae Sang']",사랑
275,The Silent Sea,Netflix,['Choi Hang Yong'],['Park Eun Kyo'],"Dec 24, 2021","Dec 24, 2021",Friday,2021,8,375.0,"Set in the future, when the planet suffers from a lack of water and food caused by desertification. Yoon Jae is a soldier for the space agency. He is selected for a team, including Ji An, to travel to the moon. A scientist joins the mission to recover mysterious samples from an abandoned lunar space station, where an accident killed everyone including her sister.(Source: AsianWiki; Netflix) ","['Lee Joon', 'Bae Doo Na', 'Gong Yoo']",고요의 바다
276,Tinted With You,Viki,['Ra Ha Na'],,2021-12-23,2022-01-14,"Thursday, Friday",2021,8,90.0,"In Korea’s feudal past, deposed Crown Prince Lee Heon was forced into exile when his cruel older brother usurped the throne. His sibling plans to permanently secure his position, leaving Lee Heon fearing for his life at every turn.  Lee Heon has one ally, Geum, his loyal, kind-hearted guard. Flash forward to the modern-day, where art is high school student Eun Ho’s entire world. He accepts a commission to complete an unfinished canvas despite its mysterious vibe. Inexplicably drawn into the distant past, he meets Lee Heon, with whom he forms a close and romantic bond. Becoming restless, the acting king desires to murder the exiled Crown Prince. Eun Ho now understands that he may be Lee Heon’s best – if not sole – chance of survival.(Source: Viki)","['Jun', 'Yoo Hyun Woo']",물들여
277,Moonshine,KBS2,['Hwang In Hyuk'],['Kim Joo Hee'],2021-12-20,2022-02-22,"Monday, Tuesday",2021,16,262.0,"An extended period of prohibition in the Joseon era proved that the restriction of alcohol was no match for human desire.Laws against imbibing, buying or making alcohol created different challenges for these inhabitants: Inspector Nam Young from The Office of the Inspector-General who left his hometown to achieve fame in Hanyang and restore his family status; Kang Ro Seo, the aristocratic but impoverished lady who makes moonshine to reduce her debt, allowing her to continue buying her mother’s medication and her brother’s books; and even Crown Prince Lee Pyo, who was prone to scaling the palace walls in search of a tipple. This trio has a fateful encounter leading to the discovery of a hidden stash of alcohol. Revealing this secret would only result in certain death.","['Kang Mi Na', 'Lee Hye Ri', 'Yoo Seung Ho', 'Byeon Woo Seok']",꽃 피면 달 생각하고
278,The One and Only,jTBC,['Oh Hyun Jong'],['Moon Jung Min'],2021-12-20,2022-02-08,"Monday, Tuesday",2021,16,262.0,"When Pyo In Sook was a child, her parents abandoned her with her grandmother who raised her. Her life has never been easy or comfortable. She now works at a public bathhouse scrubbing customer's bodies. Her defense mechanism is to not express her feelings to other people. One day, a doctor tells her she has a terminal illness and will die soon. Even coming face-to-face with her own mortality, In Sook remains emotionless. She begins receiving care at a hospice and meets two women with lives very different from her own: Seong Mi Do, a social media influencer, and Kang Se Yeon, an ordinary housewife who feels lonely and taken for granted. One rainy day, In Sook meets Min Woo Cheon, a contract killer who works at a private detective office. Woo Cheon's cool exterior masks a deep sadness. Each of the three women decides to end the life of one person who has done them wrong before they die, but in becoming friends, their anger begins to subside. When In Sook and Woo Cheon develop feelings for each other, though, she begins to rethink her plans.(Source: VIKI, AsianWiki)","['Ahn Eun Jin', 'Joy', 'Kim Kyung Nam', 'Kang Ye Won']",한 사람만
279,Wanna Sleepover Season 2,,,,2021-12-19,2022-02-13,Sunday,2021,9,67.0,,"['Seo Hye Lin', 'Kim Dong Woo']",여기서 자고 갈래 시즌2
280,Bulgasal: Immortal Souls,Netflix tvN,['Jang Young Woo'],"['Seo Jae Won', 'Kwon So Ra']",2021-12-18,2022-02-06,"Saturday, Sunday",2021,16,281.0,"The series tells the story of a man-turned-immortal, Bulgasal, who wants revenge from a woman with a mysterious past and present, who he deems responsible for his immortality and miseries from the past 600 years, hoping to free himself from his curse. (Source: IMDb) ","['Gong Seung Yeon', 'Lee Jin Wook', 'Lee Joon', 'Kwon Na Ra']",불가살
281,Snowdrop,jTBC,['Jo Hyun Taek'],['Yoo Hyun Mi'],2021-12-18,2022-01-30,"Saturday, Sunday",2021,16,338.0,"In 1987, a bloody man jumps into a women’s university dormitory in Seoul. Young Ro, a female university student who falls in love with him at first sight on a group blind date, takes care of him despite the strict surveillance and dangerous situation. However, Young Ro is shocked to learn his secret. Despite heartbreakingly watching over his first love Young Ro, Soo Ho has no choice but to move according to the command in order to save his teammates and to go back to his home country where his sibling awaits. Young Ro rejects the will of her father and works hand in hand with Soo Ho to save her beloved man and her friends. What will happen to their fate?(Source: Disney+)~~ Adapted from the handwritten journal of a North Korean defector.","['Jung Hae In', 'Yoo In Na', 'Jang Seung Jo', 'Kim Ji Soo', 'Yoon Se Ah', 'Kim Hye Yoon']",설강화
282,To.Two,,,,"Dec 17, 2021","Dec 17, 2021",Friday,2021,8,112.0,To.two is an extremely popular social media app with a catch; you can only get in based on invite. This web drama explores how this app creates social barriers between the students based on who can access the invite.(Source: nini at MyDramaList) ,"['Lee So Hee', 'Cha Yoo Jin']",투투
283,I Want to Live an Easy Life,SBS,['Go Hyun Gook'],['Oh Ji Hyun'],"Dec 17, 2021","Dec 17, 2021",Friday,2021,5,312.0,"The story of four candid and brazen girlfriends in their 30s who want to be rich but do not like to work hard, are comfortable with being alone but do not like being lonely, and want to live roughly but cannot live roughly.(Source: Korean = Naver || Translation = MyDramaList)~~ Adapted from the webtoon ""Daechung Salgo Sipseubnida"" (대충 살고 싶습니다) by Hyun Lee (현이씨). ","['Go Eun Ah', 'Heo Young Ji', 'Lee Mi So', 'Son Soo Ah']",대충 살고 싶습니다
284,Pumpkin Time,Daum Kakao TV,['Kang Min Gu'],,2021-12-17,2021-12-18,"Friday, Saturday",2021,10,120.0,"Growing up, Kang Tae Joo and Shin Hae Won were practically inseparable. The best of friends, the two elementary school boys shared a fanatic love of baseball and enjoyed nothing more than spending their time utterly immersed in the game. Though Tae Joo and Hae Won believed they would be together forever, fate decided it had other plans. After his parents announce he is moving to the United States, Tae Joo has no choice but to say goodbye to Hae Won. Despondent over being forced to leave his best friend behind, Tae Joo is determined to someday see Hae Won again. As the years pass, Tae Joo never gives up hope of being reunited with his childhood friend. As suddenly as he once had to say goodbye, Tae Joo now finds himself back in Korea where he wastes no time in searching for his best friend. Tracking Hae Won down, Tae Joo is shocked beyond words to discover that his childhood best friend is now a high school girl! Will this unexpected switch change their relationship forever?(Source: Viki)~~ Adapted from the webtoon ""Pumpkin Time"" (펌킨타임) by Gaedarae (개다래).","['Lee Soo Min', 'Shin Hyun Seung']",펌킨타임
285,Bad and Crazy,iQiyi tvN,['Yoo Seon Dong'],['Kim Sae Bom'],2021-12-17,2022-01-28,"Friday, Saturday",2021,12,350.0,"Soo Yeol, the competent ‘bad boy’ on the police squad, regains his humanity after meeting K, the righteous but ‘crazy’ guy. Despite having a mere high school diploma, Soo Yeol is an accomplished member of the Anti Corruption Unit. He’s ambitious, so he chooses pet cases of his superiors and produces their desired outcomes. Often that means turning a blind eye to injustice, especially if it stands in the way of those preferred results. With promotion time looming and without anyone’s backing, Soo Yeol fears exclusion once again. Congressman Do Yoo Gon had given him some hope of advancement but dashed when the righteous but crazy K entered his life. What can go wrong when the bad boy and the crazy guy join forces?(Source: iQiyi)","['Lee Dong Wook', 'Cha Hak Yeon', 'Wi Ha Joon', 'Han Ji Eun']",배드 앤 크레이지
286,The World of My 17 Season 2,Naver TV Cast vLive,,,2021-12-15,2022-01-14,"Wednesday, Friday",2021,10,150.0,"""18 years old, will Na Ri have her first love?"" First love, dream, friendship. The world of the girls' first 18, a sweet and sour story.(Source: Naver) ","['Lee Won Jung', 'Choi Ye Na', 'Yoo Sun Ho', 'Jihan', 'Han Chae Kyung']",소녀의 세계 시즌2
287,Love Twist,KBS2,['Kim Won Yong'],['Lee Eun Joo'],2021-12-13,2022-05-20,"Monday, Tuesday, Wednesday, Thursday, Friday",2021,103,20.0,Witness the sweet changes of heart for three inter-generational families over the love between a very special couple. (Source: Korean = Naver || Translation = MyDramaList) ,"['Ham Eun Jung', 'Kim Jin Yeop', 'Hwang Shin Hye', 'Yoon Da Hoon', 'Shim Hye Jin', 'Son Sung Yoon']",사랑의 꽈배기
288,"The King of Tears, Lee Bang Won",KBS1,['Kim Hyung Il'],['Lee Jung Woo'],2021-12-11,2022-05-01,"Saturday, Sunday",2021,32,112.0,"A work that sheds new light on the figure of Lee Bang Won, a leader who took the lead in the founding of the nation.(Source: Naver) ","['Joo Sang Wook', 'Ye Ji Won', 'Kim Yeong Cheol', 'Park Jin Hee']",태종 이방원
289,Uncle,TV Chosun Viki,"['Ji Young Soo', 'Seong Do Joon']",['Park Ji Sook'],2021-12-11,2022-01-30,"Saturday, Sunday",2021,16,262.0,"Joon Hyuk was a musician whose life has hit rock bottom after he had been scammed by people he trusted. He had ended his relationship with his older sister Joon Hee because of it. One day, suddenly, he receives a call from Joon Hee asking him to take care of her son, Min Joon.After 12 years of strife, Joon Hee divorced her physically abusive husband, at the same time ridding herself of her equally nasty mother-in-law. Joon Hee moves into an inexpensive apartment, keeping a low profile lest her former family finds her. The Royal State is a luxury apartment complex that has some noteworthy residents. Hye Ryung is the much-respected president of the Mothers’ Committee. Committee member Yoo Ra very much admires her.  Single father Kyung Il is a warm and pleasant man who continues to raise his daughter since the passing of his wife. (Source: AsianWiki)~~ Remake of the British TV series ""Uncle"" [2014].","['Oh Jung Se', 'Jeon Hye Jin', 'Lee Sang Woo', 'Park Sun Young', 'Lee Kyung Hoon', 'Lee Shi Won']",엉클
290,A DeadbEAT's Meal,Naver TV Cast TVING,['Kim Joon Mo'],['Jeon Seon Young'],2021-12-10,2022-01-14,Friday,2021,12,125.0,"Jae Ho tries to find a job, but it's not easy for him. He supports himself with working part-time jobs. Recently, his girlfriend Soo Jung dumped him after dating for 7 years. Despite his difficulties, Jae Ho's main concern is ""What should I eat today?""After working day and night for several years at an advertising company, Woon Ho almost died due to overworking. She quit her job after that. Now, it's been 3 months since she has become voluntarily unemployed. She follows her simple belief of ""Let's just think about eating delicious food.""(Source: AsianWiki)","['Go Won Hee', 'Ha Seok Jin', 'Im Hyun Joo']",백수세끼
291,Casting a Spell to You,,,,"Dec  9, 2021","Dec  9, 2021",Thursday,2021,16,225.0,"Ji Woo, a spoiled young man, comes home after hearing that his grandfather, a wealthy businessman, died. He expected a large inheritance, but he only got an old building filled with books. Mastering only in having fun, Ji Woo comes up with an idea: turn the building into a bar that only sells the drink during the day. And he recruits Joong Hee, a young woman who somehow gets involved in a few happenings with him. Joong Hee dreamed of entering the culinary school in France, but she recently lost all her savings to a scam and had a few whirlwind days because of Ji Woo. To save money again, Joong Hee reluctantly agrees to join Ji Woo's outlandish project 'Siesta.'(Source: OnDemandKorea)","['Im Ji Yeon', 'Sung Joon', 'Baek Sung Hyun', 'Kim Yoon Hye']",마법을 걸다
292,Artificial City,jTBC,['Jun Chang Geun'],['Son Se Dong'],2021-12-08,2022-02-10,"Wednesday, Thursday",2021,20,210.0,"Takes place against the backdrop of an art museum that belongs to Sung Jin Group, a major conglomerate that holds the reins of the political and financial worlds in South Korea. It is a psychological mystery thriller about the things that disappear when humans become greedy and ambitious for power.Yoon Jae Hee is the head of the Sung Jin Cultural Foundation and in charge of operations at “Space Jin,” the art museum owned by Sung Jin Group. She is also the second daughter-in-law of the family that controls Sung Jin Group. Believing that poverty is corrosive to love and that a stable income leads to a steady life, she chose to throw away her long-time lover and entered into a marriage of convenience with Jung Joon Hyuk, an illegitimate son of Sung Jin Group. In order to make her husband the nation’s president, she teams up with the future Public Prosecutor General and goes to war against Sung Jin Group.Jung Joon Hyuk is Yoon Jae Hee’s husband. Although he is a popular anchorman with his own fan club, he hides an inferiority complex over being labeled “the illegitimate son of Sung Jin Group” for his whole life. He laughs at both ambitious people and those who pretend to have no ambition even as he waits for the day when he can seize the reins of power.","['Lee Hak Joo', 'Park Soo Ae', 'Kim Kang Woo', 'Kim Mi Sook', 'Lee Yi Dam']",공작도시
293,Artificial Intelligence Hamlet,,,,2021-12-07,2022-01-04,Tuesday,2021,5,72.0,,,인공지능햄릿
294,Our Beloved Summer,Netflix SBS,['Kim Yoon Jin'],['Lee Na Eun'],2021-12-06,2022-01-25,"Monday, Tuesday",2021,16,225.0,"Years after filming a viral documentary in high school, two bickering ex-lovers get pulled back in front of the camera — and into each other's lives. Choi Woong seems naive and a free-spirited man, but he wants to have something for the first time in his life. For that, he shows what he holds in his mind. Kook Yeon Soo aimed to become the top student at her school, but she is now an adult who lives fiercely, adapting to her reality.(Source: Netflix, AsianWiki)~~ Inspired by the webtoon “Our Beloved Summer” (그 해 우리는 - 초여름이 좋아!) by Lee Naeun (이나은) and Han Kyoung Chal (한경찰) which is a prequel story that depicts their high school days 10 years before drama timeline. It is a different perspective from their past including how they first met, grew on each other and fell in love with each other. The webtoon has a story that doesn't show up in drama sequel.","['Roh Jeong Eui', 'Choi  Woo Shik', 'Kim Da Mi', 'Kim Sung Cheol']",그해 우리는
295,User Not Found,,,,2021-12-03,2022-02-12,"Friday, Saturday",2021,22,41.0,"A romance drama about two female high school students who happen to share the same name. When they both transfer to a new school at the same time, hoping to use the opportunity to turn their lives around, they forge a secret contract to swap identities. Shin Yi Joon is the most popular student at his high school. Although he seems tough and aloof on the outside, Shin Yi Joon is actually a huge softie on the inside—and far from getting into fights with other students, he even has a hard time saying no to other people.(Source: Naver; Soompi)","['Bae Jin Young', 'Shin So Hyun', 'Han Ye Ji']",@계정을 삭제하였습니다
296,The One Serving House,,,,2021-12-01,2021-12-17,"Monday, Wednesday, Friday",2021,8,98.0,"Depicts the lives of people with different backgrounds of growth, living in a single-person house.(Source: Naver) ","['Lee Yoo Jin', 'Choi Hui Seung', 'Jin So Yeon', 'Lee Jung Joon', 'Jung Min Gyu']",1인분 하우스
297,Mr. Lee,Daum Kakao TV,,,2021-11-29,2021-12-27,Monday,2021,5,240.0,"Six friends gathered at Eunjoo and Kyungho's engagement party. In a strange vibe flowing...the groom-to-be dies. And, a detective 'Mr. LEE' who doesn't look like a detective, appears. All five are suspects. I can watch the CCTV footage of the crime scene?!(Source: tv.kakao) ","['Shin Yeon Suh', 'Im Hyun Joo', 'Park Geon Il']",미스터LEE
298,Show Window: The Queen's House,Channel A Viki,"['Kang Sol', 'Park Dae Hee']",['Han Bo Kyung'],2021-11-29,2022-01-18,"Monday, Tuesday",2021,16,244.0,"From the outside, Han Sun Joo’s life has always appeared to be nothing short of perfect. Born into a wealthy family, Sun Joo and her younger brother, Han Jung Won, were raised without a care in the world. Now as adults, Jung Won has grown up extraordinarily warm-hearted, allowing him to maintain an unwavering sense of optimism while Sun Joo has become the ideal married woman, with a gorgeous home, a devoted husband and two beautiful children. Unfortunately, Sun Joo’s perfect life is on the verge of collapse.Absolutely penniless when he married Sun Joo, Shin Myung Seop has spent the entirety of his married life slowly climbing the ranks of his mother-in-law’s company, the LaReine Group. Now well-established in his career, Myung Seop appears to be a devoted husband and father, yet when he meets Yoon Mi Ra, things take a complicated turn. Unable to hide his growing feelings for Mi Ra, Myung Seop pursues her and is pleased to find she reciprocates his feelings. Soon entangled in a secret affair, Myung Seop and Mi Ra live in constant fear of discovery. (Source: Viki)","['Hwang Chan Sung', 'Lee Sung Jae', 'Jeon So Min', 'Song Yoon Ah']",쇼윈도:여왕의 집
299,One Ordinary Day,ViuTV,['Lee Myung Woo'],['Kwon Soon Gyu'],2021-11-27,2021-12-19,"Saturday, Sunday",2021,8,525.0,"A drama that explores the criminal justice system from an extremely popular perspective through the fierce story of two men surrounding the murder of a woman. Hyun Soo, an ordinary college student, suddenlybecomes the primarysuspect in a murder case. Shin Joong Han is the only lawyer willing to help Kim Hyun Soo. Having just barely passed law school, Shin Joong Han's involvement in Kim Hyun Soo's case eventuallytakes his unremarkable life to new heights.(Sources: Naver, MyDramaList)~~ Remake of the British TV series ""Criminal Justice"" [2008].","['Cha Seung Won', 'Kim Soo Hyun']",어느 날
