Unnamed: 0,drama_name,org_net,director,screenwriter,start_dt,end_dt,aired_on,year,tot_eps,time_per_ep,synopsis,actor_list,kor_title
1251,Deux Yeoza,,,,2016-01-14,2016-01-19,,2016,8,22.0,"Do you know how you and your best friend can have entire conversations in the space of a look? This web series follows the intimate telepathic (and not-so-telepathic) communication of two girls as they deal with strange men, drunk girlfriends, and scary sales associates.(Source: AsianCrush) ","['Pyo Ye Jin', 'Choi Seung Yoon']",두여자
1252,Moorim School,KBS2,['Lee So Yeon'],['Yang Jin Ah'],2016-01-11,2016-03-08,"Monday, Tuesday",2016,16,236.0,"The Moorim School is a hidden school which can only be seen by special individuals, it isn't focused solely on high academic scores but on physical abilities. The school teaches its students great virtues which include honesty, faith, sacrifice, and communication. The teachers and students at the school come from different countries and each have their own stories. Everything is very extraordinary and normal until a student who doesn't seem to fill the role, wanders into the academy and changes the destiny of all the students.","['Jung Eugene', 'Seo Yea Ji', 'Hong Bin', 'Lee Hyun Woo']",무림학교
1253,My Son-In-Law's Woman,SBS,['Ahn Gil Ho'],['Ahn Seo Jung'],2016-01-04,2016-06-17,"Monday, Tuesday, Wednesday, Thursday, Friday",2016,120,20.0,"Lee Jin Sook is a speaker on family happiness. However, she has a sad past. Years ago, she was kicked out of the house by her mother-in-law and was forced to be separated from her newborn daughter. She remarried, and when her second husband died 5 years later, she brought up her two young stepdaughters like her own. She was against the marriage when her youngest stepdaughter Oh Yeong Chae wanted to marry Kim Hyeon Tae, a rookie boxer and an orphan, but she relented. When Yeong Chae, who was involved in a hit-and-run accident, died after giving birth to a son, Jin Sook blamed and hated her son-in-law.After Yeong Chae's death, Hyeon Tae and his son stayed together with Jin Sook and treated her like his mother. When she saw how Hyeon Tae took care of his son, her attitude towards him changed. Now she treats Hyeon Tae like her real son.One day, Hyeon Tae falls in love with a woman named Park Soo Kyeong. Jin Sook, who is unhappy with Soo Kyeong, finds out that Soo Kyeong is her real daughter. Although she is eager to reunite with Soo Kyeong, she is in a dilemma as Soo Kyeong hates her birth mother for abandoning her. Hyeon Tae finally marries Soo Kyeong, but it also causes conflicts.(Source: Wikipedia)","['Jang Seung Jo', 'Seo Ha Joon', 'Yang  Jin Sung', 'Park Soon Chun']",내 사위의 여자
1254,Cheese in the Trap,tvN,['Lee Yoon Jung'],['Kim Nam Hee'],2016-01-04,2016-03-01,"Monday, Tuesday",2016,16,244.0,"Having returned to college after a year long break due to her family's poor background, Hong Seol, a hardworking over-achiever, inadvertently gets on the wrong side of her senior, Yoo Jung, who's athletic, good looking, gets good grades and has a kind personality, as well as a hidden dark side. From then on her life takes a turn for the worse and Hong Seol is almost certain it's all Yoo Jung's doing. So why is he suddenly acting so friendly a year later?(Source: WeTV)~~ Adapted from the webtoon ""Cheese in the Trap"" (치즈인더트랩) by Soonkki (순끼).","['Lee Sung Kyung', 'Kim Go Eun', 'Park Hae Jin', 'Seo Kang Joon']",치즈인더트랩
1255,Jang Young Shil,KBS1,['Kim Young Jo'],['Lee Myung Hee'],2016-01-02,2016-03-26,"Saturday, Sunday",2016,24,155.0,"The drama series follows the life of Jang Yeong Shil: a scientist, technician and inventor during the Joseon period. Jang Yeong Shil was born in the lower class nobi. King Se Jong notices his abilities and brings him to the palace. King Se Jong grants him a chance to display his abilities. He invents tools like astronomical instruments, an iron printing press and a water clock. ","['Kim Sang Kyung', 'Lee Ji Hoon', 'Kim Yeong Cheol', 'Song Il Gook', 'Jung Yoon Suk']",장영실
