Unnamed: 0,drama_name,org_net,director,screenwriter,start_dt,end_dt,aired_on,year,tot_eps,time_per_ep,synopsis,actor_list,kor_title
332,Your Playlist,,,,2021-10-15,2021-11-05,Friday,2021,8,75.0,"Life for the students at Myungsung High School gets a shake-up when |Big Daddy"", a wildly popular and charismatic idol and influencer, transfers to the school. Things get even more complicated when he appears to fall head over heels for the class president Ha Eun – the most outspoken and popular female student in the class.But ""Big Daddy"" is not the only one at the school with a soft spot for Ha Eun. Yu Dong Hoo, a sophomore at the school, also has strong feelings for her. But while he is reluctant to make his feelings known to her in real life, online he has become something of an anonymous soulmate for her. He follows her on social media and cheers her from afar by sending her carefully curated musical playlists – full of songs that unfailingly fill her with joy and happiness. Meanwhile, Cha Won Young, another sophomore (and a neat, but often clumsy student) is struggling to reconcile with his best friend after a falling-out.(Source: Viki)","['Kim Ji Hoon', 'Yoon San Ha', 'Park Su Min']",너의 재생목록
333,My Name,Netflix,['Kim Jin Min'],['Kim Ba Da'],"Oct 15, 2021","Oct 15, 2021",Friday,2021,8,375.0,"Following her father's murder, a revenge-driven woman puts her trust in a powerful crime boss — and enters the police force under his direction.Yoon Ji Woo, a member of a organized crime ring, goes undercover as a police officer and harbors cold revenge in her heart. Helping Yoon Ji Woo go undercover is Choi Moo Jin, the boss of the biggest drug ring in Korea, whose true motives are not easy to read.Jeon Pil Do is a police detective in the Drug Investigation Unit. He is a stickler for rules who becomes Yoon Ji Woo’s partner when she joins the police. Cha Gi Ho is the team leader of the Drug Investigation Unit. He and Choi Moo Jin have long been enemies, with Cha Gi Ho vowing to take down his crime ring before he retires.Jung Tae Joo is Choi Moo Jin’s subordinate in the drug ring. Because of his steadfast loyalty, he is Choi Moo Jin’s most trusted henchman. Do Gang Jae is a former member of the drug ring. After causing problems and getting kicked out of the gang, he vowed revenge against them.(Source: Soompi, Netflix)","['Ahn Bo Hyun', 'Park Hee Soon', 'Han So Hee']",마이 네임
334,Focus to You 3,,,,2021-10-14,2021-11-11,Thursday,2021,5,132.0,,"['Choi Jin Hyuk', 'Han Ji Woo', 'Yang Kyung Hyeon', 'Kim Ha Song', 'Choi Yong Jun']",너에게로 줌 시즌3
335,I Don't Care,,,,2021-10-13,2021-11-17,Wednesday,2021,6,120.0,"Depicting the reckless challenges, failures, and triumphs of prospective groom Lee Ro Woon, who transforms into a financial expert for 24 hours to recover the money he needs to buy a house. (Source: Naver) ","['Park Eun Woo', 'Min Chan Ki']",아이돈케어
336,Reflection of You,jTBC Netflix,['Im Hyun Wook'],['Yoo Bo Ra'],2021-10-13,2021-12-02,"Wednesday, Thursday",2021,16,262.0,"The story of love, betrayal, corruption, and revenge that takes place within the life of a woman who briefly leaves behind her picture-perfect lifestyle to give in to her desires, and another woman who meets her during this period and loses the light of her life.Jung Hee Joo had a tough time during her youthful days, but she is now a successful painter and essayist. Her husband, Ahn Hyun Sung, is the successor of a hospital, and together have two children. Her family life seems enviable, but Hee Joo feels like she spends her time meaninglessly, and at that time, she meets Gu Hae Won. She is a poor art teacher, much like Hee Joo in her younger days, but she is still shines and is full of life.(Source: MyDramaList)~~ Adapted from the short story ""Someone Who Looks Like You"" (너를 닮은 사람) by Jung So Hyeon (정소현).","['Shin Hyun Bin', 'Choi Won Young', 'Kim Jae Young', 'Go Hyun Jung']",너를 닮은 사람
337,Dalgona Season 2,,,,2021-10-11,2021-10-28,"Monday, Thursday",2021,6,150.0,A drama that depicts the process of future generations developing a sense of integrity while standing up against discrimination and injustice in everyday life.(Source: kpopmap) ,"['Han Se Jin', 'Park Chae Rin']",달달하지만 고된 나의 사춘기
338,The King's Affection,KBS2 Netflix,"['Song Hyun Wook', 'Lee Hyun Suk']",['Han Hee Jung'],2021-10-11,2021-12-14,"Monday, Tuesday",2021,20,210.0,"The story is set during the Joseon Dynasty, at a time when twins were considered an ominous sign. As a result, when the Crown Princess Consort gives birth to twins, an order is sent to kill the daughter. To save her, she is secretly sent out of the palace.A few years later, the twin daughter Dam Yi returns to the palace to work as a maid. When the male twin, Lee Hwi, loses his life through a case of mistaken identity, their mother, having recognised her daughter as court maid Dam Yi, persuades her to take Lee Hwi's place. Although she distances herself from everybody, Dam Yi starts developing feelings for Jung Ji Woon, her original first love and later teacher who comes from a noble family.(Source: Wikipedia)~~ Adapted from the manhwa ""Yeonmo"" (연모) by Lee So Young (이소영).","['Jung Chae Yeon', 'Bae Yoon Kyung', 'Nam Yoon Su', 'Park Eun Bin', 'Rowoon', 'Choi Byung Chan']",연모
339,Real Siblings,,,,2021-10-09,2021-10-30,"Wednesday, Saturday",2021,7,34.0,A realistic story of a real brother and sister.(Source: 씬앤박스 SCENE AND BOX on Youtube) ,,현실남매
340,Peng,,['Baek Min Hee'],['Han Soo Ji'],2021-10-07,2021-11-05,"Thursday, Friday",2021,10,114.0,"Saying goodbye to her twenties, thirty-year-old Go Sa Ri welcomes this new decade of her life with open arms. Leaving behind the tangled mess of her twenties, Sa Ri is ready to make a fresh start. But walking away from the past is proving more difficult than she ever imagined. Having recently broken up with her boyfriend, Sa Ri was hopeful she had left that part of her life in the past. But when he makes an unexpected return, things get complicated. As if dealing with her ex wasn’t confusing enough, Sa Ri begins to realize that one of her oldest friends, Pi Jung Won, has started to develop feelings for her. As she attempts to sort out her own feelings for the talented artist, Sa Ri finds herself frequently crossing paths with Ki Sun Jae, the handsome and friendly CEO of the company where she works. Though it’s not always easy to tell what Sun Jae is thinking, there are times when a single look from him is enough to make her confused heart flutter. To make matters worse, Sa Ri finds that she has inadvertently captured the attention of Yeon Ha Rim. Despite the fact that he’s several years younger than her, he has no qualms about expressing his feelings.Inadvertently drawing the attention of four different men, Sa Ri finds herself completely unsure of what to do next. How can she find a way to move forward when every path seems blocked by a complicated mess of feelings?(Source: Viki)","['Kim Hyun Jin', 'Yoon So Hee', 'Choi Won Myung', 'Joo Woo Jae', 'Lee Seung Il']",팽
341,Jinx,Daum Kakao TV,['Nam Tae Jin'],['Moon Woo Young'],2021-10-06,2021-11-06,"Wednesday, Saturday",2021,10,120.0,"Kyu Han, a seemingly ordinary student, is cursed with an unlucky jinx. Every time he sneezes, things go exactly the opposite of what he hopes, forcing him into all sorts of unfortunate situations in his daily life. However, despite his supernatural bad luck, he still romantically chooses to pursue his one-sided crush, believing that if he just tries his hardest, there’s nothing he can’t achieve.","['Chani', 'Eunseo']",징크스
342,A Beauty of Revenge,,,,2021-10-05,2021-11-02,Tuesday,2021,5,120.0,A story about a girl Park Minsun getting revenge on her bullies by changing her appearance and identity. She executes a plan to damage the leader of the delinquent group who has sociopathic tendencies.~~ Based on the the web drama 'Multi Personality Girl EP0' (2019). ,"['Jang Yeo Bin', 'Son Ho Tae', 'Park Young Jae', 'Park Min Sun']",복수여신
343,The All-Round Wife,KBS1,['Choi Ji Yeong'],['Kim Ji Wan'],2021-10-04,2022-04-08,"Monday, Tuesday, Wednesday, Thursday, Friday",2021,122,17.0,"A drama centered around the district of Gangnam and Seo Cho Hee, a woman who struggles to improve the quality of life with a house. It has a realistic family message that happiness is not about the house but about the family that lives in it.(Source: Naver) ","['Han Da Gam', 'Han Sang Jin', 'Shim Ji Ho']",국가대표 와이프
344,Mumul Zzumul,Channel A,,,2021-09-29,2022-01-12,Wednesday,2021,14,69.0,"Depicting problems like bullying, dating, gaslighting and friendship issues surrounding high school teenagers.(Source: Xavier Ng at MyDramaList) ","['Park Yeon Ah', 'Lee So E', 'Ma Hyun Ji']",무물쭈물
345,The Moment the Heart Shines,EBS,,,2021-09-28,2021-12-21,Tuesday,2021,13,138.0,Depicts the story of teens in current era of digital and will show a heart-fluttering high school romance.(Source: Naver) ,"['Jung Su Bin', 'Oh Jae Woong', 'Shin So Hyun', 'Choi Ji Su']",하트가 빛나는 순간
346,Young Lady and Gentleman,KBS2,['Shin Chang Seok'],['Kim Sa Kyung'],2021-09-25,2022-03-27,"Saturday, Sunday",2021,52,81.0,"Lee Young Kook is a widower with three children. He still hasn’t gotten over the death of his wife. He decides to hire Park Dan Dan as a live-in tutor for his kids, and he becomes attracted to her. Meanwhile, Park Dan Dan has a bright and positive personality despite her harsh situation.(Source: AsianWiki) ","['Park Ha Na', 'Lee Se Hee', 'Ji Hyun Woo', 'Kang Eun Tak']",신사와 아가씨
347,The Tasty Florida,,"['Yang Kyung Hee', 'Yang Kyeong Hui']",,2021-09-24,2021-10-15,Friday,2021,8,82.0,"Having just moved in, college freshman Seo Hae Won isn’t sure what to think of the guesthouse he now calls home. With Florida Banjeom, a popular Chinese restaurant, comfortably settled up on the roof, people from far and wide are always running in and out of the building. But it’s not the constant stream of guests that has Hae Won concerned; it’s the fact that the restaurant’s owner and head chef, Baek Eun Kyu, seems to have a serious problem with him. Having been recommended for a part-time job at the restaurant by Cha Ji Soo, a fellow restaurant owner, Hae Won thought he would easily fit in with the staff; but for some reason, Eun Kyu seems to instantly dislike him. Despite the fact that he can’t figure out why his boss is so bothered by him, Hae Won finds himself fitting in nicely with his fellow staff members, Ha Jin and Joo Seo Hyuk. It isn’t long before he’s drawing as much attention from the restaurant patrons as his equally handsome co-workers. With such a good-looking staff, there’s never a shortage of admirers at the Florida Banjeom. It comes as no surprise to Hae Won that almost everyone who visits the restaurant eventually falls for the devastatingly handsome Eun Kyu. What does surprise him is when he realizes that he himself has fallen. But will he ever be able to win the heart of his cold-hearted boss? (Source: Viki)","['Cha Woo Min', 'Yoo Hwan']",플로리다반점
348,Hometown,tvN,['Park Hyun Suk'],['Cho Hyun Hoon'],2021-09-22,2021-10-28,"Wednesday, Thursday",2021,12,350.0,"Set in a smallrural town in 1999 where a recording tape containing a mysterious serial murder and an unidentified bizarre sound is discovered.In 1989, terrorist Jo Kyung Ho came back to South Korea after studying in Japan and released sarin gas at a train station in his hometown, killing passengers and subsequently being sentenced to life in prison after turning himself in. His daughter, Jo Jae Young, is sent to live with her aunt, Kyung Ho's younger sister, Jo Jung Hyun.Ten years later, a murder case takes place in the small town with Detective Choi Hyung being put in charge. Suspecting that the case is somehow related to the terrorists, Choi Hyung, who is consumed with the guilt of failing to prevent his wife’s death 10 years ago in the terrorist attack, begins investigating when Jung Hyun's niece suddenly goes missing. Jung Hyun now must come face to face with tragedy once again and she teams up with Choi Hyung to discover the truth and find her niece.(Source: Soompi, NamuWiki, AsianWiki)","['Yoo Jae Myung', 'Han Ye Ri', 'Uhm Tae Goo']",홈타운
349,Dali and the Cocky Prince,KBS2,['Lee Jung Sub'],['Son Eun Hye'],2021-09-22,2021-11-11,"Wednesday, Thursday",2021,16,244.0,"As a young boy, Moo Hak grew up in the market as a peddler. Although he is ignorant, he is strong-willed and knows how to make money. He is now the managing director of Dondon F and B, a global restaurant chain that his family started as a small gamjatang diner. However, he isn't dignified and only cares about money. He meets Da Li, the only daughter and child of an upper-class family who runs an art gallery. She has a profound deep knowledge of things. She gets faced with bankruptcy due to her father's sudden death and begins a hard life. Moo Hak and Da Li start a relationship as a creditor and debtor over the art gallery. Will these two polar opposites understand each other and fall in love?(Source: Viki)","['Park Gyu Young', 'Yeonwoo', 'Hwang Hee', 'Kim Min Jae', 'Kwon Yool']",달리와 감자탕
350,One the Woman,SBS,['Choi Young Hoon'],['Kim Yoon'],2021-09-17,2021-11-06,"Friday, Saturday",2021,16,262.0,"Yeon Joo is an elite prosecutor who started from the bottom. Although known as the best in corruption investigations for the Supreme Prosecutor’s Office, she suffers amnesia after a car crash when chasing a suspect. As she wakes, she finds herself being Kang Mi Na, the daughter-in-law of the conglomerate Hanju Group. Before her disappearance, Mi Na was a troublemaker born out of wedlock. Now sitting in her position, Yeon Joo is not able to hide her rough and outspoken nature. She then meets Seung Wook, a conglomerate who visits his first love Mi Na to reveal the truth of his father’s death. Will Yeon Joo and Mi Na be able to regain their lost memories in this mystery and succeed in true love?(Source: Viki)","['Jin Seo Yun', 'Lee Sang Yoon', 'Lee Won Keun', 'Lee Ha Nee']",원 더 우먼
351,The Veil,MBC,['Kim Sung Yong'],['Park Seok Ho'],2021-09-17,2021-10-23,"Friday, Saturday",2021,12,350.0,"A Korean-style spy investigation show with a story about a top National Intelligence Service (NIS) agent. In his endeavor to uncover the internal traitor that brought him to his downfall, he confronts a much bigger enemy behind the organization. Han Ji Hyuk is the top field agent in the NIS. He isheld in awe by his colleagues for his perfect record and skill at completing missions. He hadbeen driving an organized crime syndicate into a cornerwhen he vanished off the face of the earth, but he returns in the most horrific state and doesn't remember anything that happened within the last year. With his memory lost, Ji Hyuk gets assigned to a team with minor tasks. While on the team, he meets Je Yi, who is delicate and heartwarming but with a painful past.Seo Soo Yeon is the head of team 4 of the Crime Information Center who is excellent at performing her duties and solving cases. She has great affection for people, and she especially cares for her teammates.(Source: Soompi, Viki, MBC Global Media)","['Kim Ji Eun', 'Namkoong Min', 'Park Ha Sun']",검은 태양
352,Yumi's Cells,TVING tvN,['Lee Sang Yeob'],"['Song Jae Jung', 'Kim Yoon Joo', 'Kim Kyung Ran']",2021-09-17,2021-10-30,"Friday, Saturday",2021,14,300.0,"Controlled by a complex network of cells, each and every human on the planet is kept running by an unseen operating system that is, for the most part, completely ignored. Though humans never give much thought to how they manage to function, day in and day out, the cells within the human body are constantly at work, doing their part to keep their humans alive and well. This is why on the outside, Kim Yoo Mi may appear to be just like every other single working woman in the world, but underneath that ordinary exterior lies something truly extraordinary. Having recently suffered a painful breakup, Yoo Mi’s love cells have fallen into a deep coma. While the surrounding cells work hard to revive their fallen compatriots, Yoo Mi spends her days stuck in the grind of everyday life. With a heart still broken and no romantic prospects, Yoo Mi’s love cells might have been in serious trouble had it not been for the sudden appearance of Goo Woong. An emotionally stunted game developer, Goo Woong has no idea how to express his true feelings, but after meeting Yoo Mi, he finds himself wanting to try. With his own love cells unexpectedly sparking Yoo Mi’s back to life, things between the two start to get interesting.  With both Yoo Mi and Goo Woong’s cells working overtime, the two find themselves drawing ever closer. But will the efforts of this small collection of cells really be enough to bring two hearts together forever?(Source: Viki)~~ Adapted from the webtoon ""Yumi's Cells"" (유미의 세포들) by Lee Dong Geon (이동건).","['Ahn Bo Hyun', 'Kim Go Eun']",유미의 세포들
353,Squid Game,Netflix,,,"Sep 17, 2021","Sep 17, 2021",Friday,2021,9,400.0,"After a failed business venture, the debt-ridden chauffeur Seong Gi Hun lives his life gambling away the money he mooches off his elderly mother while failing to provide for her and his estranged daughter. When his life finally hits rock bottom, he receives an irresistible offer promising him a ₩45.6 billion prize in exchange for winning traditional Korean children's games against 455 other players, among them his childhood friend Cho Sang Woo. Commencing the games, the participants soon learn of the deadly consequences that come with losing.(Source: MyDramaList)","['Park Hae Soo', 'Wi Ha Joon', 'Lee Jung Jae', 'Jung Ho Yeon']",오징어 게임
354,Straight Sassy,,,,2021-09-12,2021-12-05,,2021,8,52.0,,"['Jung Yoo Hyeon', 'Lee Gun chang']",솔직발칙
355,Can You Deliver Time? 2002,,,,2021-09-10,2021-10-29,Friday,2021,8,112.0,"Kim Woo Ri is a 20-year-old freshman. She dreamed of being a normal kid who could live free and independent. However, because the coronavirus is spreading, it makes her unable to do anything.One day she had a big fight with her mother. She wanted to live alone, but her mother wouldn't let her. The next day, she order her favorite food, and suddenly she was sent back to year 2002.(Source: filiaang at MyDramaList)","['Lee Won Jung', 'Jo Ah Young', 'Han So Eun', 'Min Se Woong']",시간도 배달이 되나요 2002
356,Love in Black Hole,Tencent Video,['Hong Chung Gi'],,2021-09-10,2021-10-16,"Friday, Sunday",2021,12,50.0,"Tells the story of a college student namedEun Ha, who one day receives an anonymous love letter through a supernatural portal - the white hole!(Source: Allkpop) ","['Lee Han Gyul', 'Seola', 'Lee Jae Yoon', 'Doha', 'Ki Hui Hyun']",러브 인 블랙홀
357,Some Air,,,,2021-09-10,2021-11-12,Friday,2021,10,96.0,"Depicts the romantic meeting of four men and women in a thrilling airplane, an airport, and an unfamiliar city.(Source: Naver) ","['Hong Eun Ki', 'Anne', 'Choi Hye Jin', 'Park Yong Je', 'Lee Gyu Hyung']",썸에어
358,Mokkoji Kitchen,,,,2021-09-06,2021-11-08,Monday,2021,9,67.0,"A sweet and salty love recipe dramathat revolves around chef Moo Young, who runs a one-person fusion Korean restaurant, and college student Ro In, who knows all the delicious restaurants. The two fatefully become intertwined in each other’s lives and end up sharing food to fill their hearts.(Source: Naver) ","['Gongchan', 'Nam Kyu Hee']",모꼬지 키친
359,High Class,tvN,['Ashbun'],,2021-09-06,2021-11-01,"Monday, Tuesday",2021,16,262.0,"A mystery suspense drama about the dangerous lies and hypocrisieshidden behind the perfect lives of the women who live in the top 0.1 percent of society.Song Yeo Wool, who loses everything when she is framed for her husband’s murder. Nam Ji Sun, the “queen bee” among the mothers at the international school where Song Yeo Wool’s son attends. Danny Oh, a teacher at the school and a former ice hockey player. Hwang Na Yoon, a single mother who is the only one who is friendly to Song Yeo Wool. Cha Do Young, a former top actress who follows Nam Ji Sun around because she wants to be back in the spotlight.","['Ha Joon', 'Cho Yeo Jung', 'Kim Jee Soo', 'Park Se Jin', 'Gong Hyun Joo']",하이클래스
360,Lost,iQiyi jTBC,"['Hur Jin Ho', 'Park Hong Soo']",['Kim Ji Hye'],2021-09-04,2021-10-24,"Saturday, Sunday",2021,16,262.0,"At forty years old, Lee Boo Jeong has lost her way. She feels like she has reached the end of her potential and achieved absolutely nothing. Lee Kang Jae is twenty-seven, a man at the end of his youth, and though ""afraid of nothing,"" feels afraid his life will never amount to anything. ""Lost"" tells the story of ordinary people walking towards the light who suddenly realize that 'nothing has happened' in the middle of the downhill road of life. It depicts the most ordinary daily life standing on the edge of darkness rather than light, a life where one cannot easily choose.(Source: JTBC, OSEN)","['Jeon Do Yeon', 'Kim Hyo Jin', 'Park Byung Eun', 'Ryu Joon Yeol']",인간실격
361,No One Special,,,,2021-08-31,2021-10-22,"Tuesday, Friday",2021,16,30.0,,"['Jung Soo Han', 'Kim Jung Ah']",별거 없지만 주인공입니다
362,You Raise Me Up,,['Kim Jang Han'],['Mo Ji Hye'],"Aug 31, 2021","Aug 31, 2021",Tuesday,2021,8,315.0,"A comedy-drama surrounding Do Yong Shik, who is experiencing decreased sex drive in his 30s, as he reunites with his first love Lee Ru Da, who is his urologist. 31-year-old Do Yong Shik, who is preparing for his civil service examination. Not only has he put on weight while studying for the exam, but he also has to get treated by a urologist. However, he despairs when he meets his doctor, who is his first love. Urologist Lee Ru Da has exceptional visuals and comes from an affluent family; the only problem is her overconfident boyfriend. To bring him down a notch, she bragged about her amazing first love. However, when Lee Ru Da reunites with him at the hospital, he is not the person he used to be. To save face, she starts a mission to help him raise his self-esteem. Lee Ru Da’s problematic boyfriend Do Ji Hyuk is a psychiatrist who runs a psychological counseling center in the same building as Lee Ru Da. He was born in a wealthy family, is a private practice physician, and has flawless visuals, making him a man who seems to have everything. The only problem is that he’s also too aware of these facts. Getting high on his charms, he has a talent for making his girlfriend angry.","['Park Ki Woong', 'Ahn Hee Yeon', 'Yoon Shi Yoon']",유 레이즈 미 업
363,The Guys I Want to Catch,,,,2021-08-30,2021-11-01,Monday,2021,10,96.0,"Four rookie cops in Noryangjin, who failed their police exams, are known to all as ‘The F-4’. That’s ‘F’, as in ‘Failure’. Witness them pursuing criminals who have violated the law in varying ways. Do the bad guys even need to worry ‘The F-4’ is hot on their trails?! (Source: Soompi; Edited by Lee C) ","['Lim Se Jun', 'Son Dong Woon', 'Niel', 'Jung Woo Seok']",잡고 싶은 녀석들
364,Peach of Time,Tencent Video,"['Park Sun Jae', 'Jang Eui Soon']",['Yang Joo Hyun'],2021-08-30,2021-09-27,"Monday, Tuesday",2021,10,162.0,"Peach, a 22-year old Thai boy, takes a daring step in his life and decides to  fly to Korea to meet his Korean friend, Yoon Oh. They first met when Yoon Oh visited the restaurant Peach's parents own in Phuket.Everything seems perfect for Peach. He finally realized his dream! On top  of that, as he stays in his friend's house, the two can finally be together.  But something just doesn't seem right. Sung Suk, Yoon Oh’s mother,  seems to be cautious and reserved in Peach's presence. She is harsh with  her son and Peach soon realizes that the two do not get along well.Willing to help his friend, Peach takes matters in his own hands and tries  to mend the strained relationship. He just wants Yoon Oh to be happy...  and if he can make it happen, he will! But what is that weird feeling in Peach's heart? Does he like Yoon Oh...? (Source: hanyang-bls.com)","['Choi Jae Hyun', 'Jimmy Karn Kritsanaphan', 'Tommy Sittichok Pueakpoolpol']",시간의 복숭아
365,Lovers of the Red Sky,SBS Viki ViuTV,"['Jang Tae Yoo', 'Nam Tae Jin']",['Kim Young Young'],2021-08-30,2021-10-26,"Monday, Tuesday",2021,16,262.0,"During the Joseon Dynasty, a young woman named Hong Chun Ki is a painter – a true rarity in Joseon Korea, where Confucian values dictate that such pursuits are unsuitable for a woman. She was born blind, but somehow managed to acquire a sense of vision. Now she has been accepted to the most prestigious art college in the land.One day, she meets Ha Ram, an astrologer whose fate is the polar opposite of her own: Although he was born sighted, he lost his vision in a childhood accident. Regardless, he is also in possession of an astounding talent that allows him to read the future by tracing the movement of the sky at night, despite the fact that he is blind.The duo is sucked into the machinations of the royal court, particularly those involving two princes, the free-spirited Prince Yang Myung, and the cruel, scheming, Prince Joo Hyang – a man who longs to become the next Joseon king.(Source: Viki)~~ Adapted from the novel ""Hong Chun Ki"" (홍천기) by Jung Eun Gwol (정은궐).","['Ahn Hyo Seop', 'Kwak Shi Yang', 'Kim Yoo Jung', 'Gong Myung']",홍천기
